07:38:20.781993 00:22:48:56:04:a4 > 12:34:56:78:9a:bc, ethertype IPv4 (0x0800), length 274: 10.224.0.6.22 > 10.225.0.4.40954: Flags [P.], seq 3157161753:3157161961, ack 76355583, win 501, options [nop,nop,TS val 373598740 ecr 4189408268], length 208
07:38:20.782487 00:42:68:b1:9a:e1 > 00:22:48:56:04:a4, ethertype IPv4 (0x0800), length 66: 10.225.0.4.40954 > 10.224.0.6.22: Flags [.], ack 208, win 1703, options [nop,nop,TS val 4189409173 ecr 373598740], length 0
07:38:20.917012 00:22:48:56:04:a4 > 12:34:56:78:9a:bc, ethertype IPv4 (0x0800), length 66: 10.244.24.17.49819 > 10.244.20.6.53: Flags [S], seq 805711644, win 8188, options [mss 1460,nop,wscale 8,nop,nop,sackOK], length 0
07:38:20.917035 00:22:48:56:04:a4 > 12:34:56:78:9a:bc, ethertype IPv4 (0x0800), length 66: 10.244.24.17.11882 > 10.244.0.174.53: Flags [S], seq 1909966995, win 8188, options [mss 1460,nop,wscale 8,nop,nop,sackOK], length 0
07:38:20.917071 00:22:48:56:04:a4 > 12:34:56:78:9a:bc, ethertype IPv4 (0x0800), length 66: 10.224.0.6.55827 > 104.43.115.6.80: Flags [S], seq 433761713, win 8188, options [mss 1460,nop,wscale 8,nop,nop,sackOK], length 0
07:38:20.917086 00:22:48:56:04:a4 > 12:34:56:78:9a:bc, ethertype IPv4 (0x0800), length 66: 10.224.0.6.12564 > 20.195.43.37.80: Flags [S], seq 3662834772, win 8188, options [mss 1460,nop,wscale 8,nop,nop,sackOK], length 0
07:38:20.918038 00:42:68:b1:9a:e1 > 00:22:48:56:04:a4, ethertype IPv4 (0x0800), length 66: 10.244.20.6.53 > 10.244.24.17.49819: Flags [S.], seq 4166709473, ack 805711645, win 64240, options [mss 1418,nop,nop,sackOK,nop,wscale 7], length 0
07:38:20.918078 00:42:68:b1:9a:e1 > 00:22:48:56:04:a4, ethertype IPv4 (0x0800), length 66: 10.244.0.174.53 > 10.244.24.17.11882: Flags [S.], seq 1173984672, ack 1909966996, win 64240, options [mss 1418,nop,nop,sackOK,nop,wscale 7], length 0
07:38:20.918132 00:22:48:56:04:a4 > 12:34:56:78:9a:bc, ethertype IPv4 (0x0800), length 54: 10.244.24.17.49819 > 10.244.20.6.53: Flags [F.], seq 1, ack 1, win 32, length 0
07:38:20.918164 00:22:48:56:04:a4 > 12:34:56:78:9a:bc, ethertype IPv4 (0x0800), length 54: 10.244.24.17.11882 > 10.244.0.174.53: Flags [F.], seq 1, ack 1, win 32, length 0
07:38:20.918448 00:42:68:b1:9a:e1 > 00:22:48:56:04:a4, ethertype IPv4 (0x0800), length 66: 20.195.43.37.80 > 10.224.0.6.12564: Flags [S.], seq 2743359293, ack 3662834773, win 64240, options [mss 1440,nop,nop,sackOK,nop,wscale 7], length 0
07:38:20.918488 00:22:48:56:04:a4 > 12:34:56:78:9a:bc, ethertype IPv4 (0x0800), length 54: 10.224.0.6.12564 > 20.195.43.37.80: Flags [F.], seq 1, ack 1, win 32, length 0
07:38:20.918554 00:42:68:b1:9a:e1 > 00:22:48:56:04:a4, ethertype IPv4 (0x0800), length 60: 10.244.20.6.53 > 10.244.24.17.49819: Flags [F.], seq 1, ack 2, win 502, length 0
07:38:20.918590 00:22:48:56:04:a4 > 12:34:56:78:9a:bc, ethertype IPv4 (0x0800), length 54: 10.244.24.17.49819 > 10.244.20.6.53: Flags [.], ack 2, win 32, length 0
07:38:20.918633 00:42:68:b1:9a:e1 > 00:22:48:56:04:a4, ethertype IPv4 (0x0800), length 66: 104.43.115.6.80 > 10.224.0.6.55827: Flags [S.], seq 90913898, ack 433761714, win 64240, options [mss 1440,nop,nop,sackOK,nop,wscale 7], length 0
07:38:20.918662 00:22:48:56:04:a4 > 12:34:56:78:9a:bc, ethertype IPv4 (0x0800), length 54: 10.224.0.6.55827 > 104.43.115.6.80: Flags [F.], seq 1, ack 1, win 32, length 0
07:38:20.918687 00:42:68:b1:9a:e1 > 00:22:48:56:04:a4, ethertype IPv4 (0x0800), length 60: 10.244.0.174.53 > 10.244.24.17.11882: Flags [F.], seq 1, ack 2, win 502, length 0
07:38:20.918721 00:22:48:56:04:a4 > 12:34:56:78:9a:bc, ethertype IPv4 (0x0800), length 54: 10.244.24.17.11882 > 10.244.0.174.53: Flags [.], ack 2, win 32, length 0
07:38:20.919476 00:42:68:b1:9a:e1 > 00:22:48:56:04:a4, ethertype IPv4 (0x0800), length 60: 104.43.115.6.80 > 10.224.0.6.55827: Flags [F.], seq 1, ack 2, win 502, length 0
07:38:20.919512 00:22:48:56:04:a4 > 12:34:56:78:9a:bc, ethertype IPv4 (0x0800), length 54: 10.224.0.6.55827 > 104.43.115.6.80: Flags [.], ack 2, win 32, length 0
07:38:20.919545 00:42:68:b1:9a:e1 > 00:22:48:56:04:a4, ethertype IPv4 (0x0800), length 60: 20.195.43.37.80 > 10.224.0.6.12564: Flags [F.], seq 1, ack 2, win 502, length 0
07:38:20.919572 00:22:48:56:04:a4 > 12:34:56:78:9a:bc, ethertype IPv4 (0x0800), length 54: 10.224.0.6.12564 > 20.195.43.37.80: Flags [.], ack 2, win 32, length 0
07:38:21.040987 00:22:48:56:04:a4 > 12:34:56:78:9a:bc, ethertype IPv4 (0x0800), length 66: 10.224.0.6.36589 > 3.93.3.247.80: Flags [S], seq 1105922992, win 8188, options [mss 1460,nop,wscale 8,nop,nop,sackOK], length 0
07:38:21.041015 00:22:48:56:04:a4 > 12:34:56:78:9a:bc, ethertype IPv4 (0x0800), length 66: 10.224.0.6.64252 > 3.83.34.110.80: Flags [S], seq 252952844, win 8188, options [mss 1460,nop,wscale 8,nop,nop,sackOK], length 0
07:38:21.239523 00:22:48:56:04:a4 > 12:34:56:78:9a:bc, ethertype IPv4 (0x0800), length 104: 10.224.0.6.37596 > 23.98.122.166.443: Flags [P.], seq 721724549:721724587, ack 1635516791, win 4290, options [nop,nop,TS val 645761162 ecr 13349771], length 38
07:38:21.244838 00:42:68:b1:9a:e1 > 00:22:48:56:04:a4, ethertype IPv4 (0x0800), length 2878: 23.98.122.166.443 > 10.224.0.6.37596: Flags [P.], seq 1:2813, ack 38, win 9885, options [nop,nop,TS val 13351029 ecr 645761162], length 2812
07:38:21.244838 00:42:68:b1:9a:e1 > 00:22:48:56:04:a4, ethertype IPv4 (0x0800), length 2878: 23.98.122.166.443 > 10.224.0.6.37596: Flags [P.], seq 2813:5625, ack 38, win 9885, options [nop,nop,TS val 13351029 ecr 645761162], length 2812
07:38:21.244838 00:42:68:b1:9a:e1 > 00:22:48:56:04:a4, ethertype IPv4 (0x0800), length 2878: 23.98.122.166.443 > 10.224.0.6.37596: Flags [P.], seq 5625:8437, ack 38, win 9885, options [nop,nop,TS val 13351029 ecr 645761162], length 2812
07:38:21.244838 00:42:68:b1:9a:e1 > 00:22:48:56:04:a4, ethertype IPv4 (0x0800), length 2878: 23.98.122.166.443 > 10.224.0.6.37596: Flags [P.], seq 8437:11249, ack 38, win 9885, options [nop,nop,TS val 13351029 ecr 645761162], length 2812
07:38:21.244890 00:22:48:56:04:a4 > 12:34:56:78:9a:bc, ethertype IPv4 (0x0800), length 66: 10.224.0.6.37596 > 23.98.122.166.443: Flags [.], ack 2813, win 4269, options [nop,nop,TS val 645761167 ecr 13351029], length 0
07:38:21.244904 00:22:48:56:04:a4 > 12:34:56:78:9a:bc, ethertype IPv4 (0x0800), length 66: 10.224.0.6.37596 > 23.98.122.166.443: Flags [.], ack 5625, win 4253, options [nop,nop,TS val 645761168 ecr 13351029], length 0
07:38:21.244920 00:42:68:b1:9a:e1 > 00:22:48:56:04:a4, ethertype IPv4 (0x0800), length 1597: 23.98.122.166.443 > 10.224.0.6.37596: Flags [P.], seq 11249:12780, ack 38, win 9885, options [nop,nop,TS val 13351029 ecr 645761162], length 1531
07:38:21.244923 00:22:48:56:04:a4 > 12:34:56:78:9a:bc, ethertype IPv4 (0x0800), length 66: 10.224.0.6.37596 > 23.98.122.166.443: Flags [.], ack 11249, win 4216, options [nop,nop,TS val 645761168 ecr 13351029], length 0
07:38:21.244932 00:22:48:56:04:a4 > 12:34:56:78:9a:bc, ethertype IPv4 (0x0800), length 66: 10.224.0.6.37596 > 23.98.122.166.443: Flags [.], ack 12780, win 4205, options [nop,nop,TS val 645761168 ecr 13351029], length 0
07:38:21.245134 00:22:48:56:04:a4 > 12:34:56:78:9a:bc, ethertype IPv4 (0x0800), length 101: 10.224.0.6.37596 > 23.98.122.166.443: Flags [P.], seq 38:73, ack 12780, win 4290, options [nop,nop,TS val 645761168 ecr 13351029], length 35
07:38:21.245172 00:22:48:56:04:a4 > 12:34:56:78:9a:bc, ethertype IPv4 (0x0800), length 101: 10.224.0.6.37596 > 23.98.122.166.443: Flags [P.], seq 73:108, ack 12780, win 4290, options [nop,nop,TS val 645761168 ecr 13351029], length 35
07:38:21.245866 00:42:68:b1:9a:e1 > 00:22:48:56:04:a4, ethertype IPv4 (0x0800), length 66: 23.98.122.166.443 > 10.224.0.6.37596: Flags [.], ack 108, win 9885, options [nop,nop,TS val 13351030 ecr 645761168], length 0
07:38:21.269538 00:42:68:b1:9a:e1 > 00:22:48:56:04:a4, ethertype IPv4 (0x0800), length 66: 3.93.3.247.80 > 10.224.0.6.36589: Flags [S.], seq 3186144936, ack 1105922993, win 62727, options [mss 1460,nop,nop,sackOK,nop,wscale 7], length 0
07:38:21.269687 00:22:48:56:04:a4 > 12:34:56:78:9a:bc, ethertype IPv4 (0x0800), length 54: 10.224.0.6.36589 > 3.93.3.247.80: Flags [F.], seq 1, ack 1, win 32, length 0
07:38:21.271534 00:42:68:b1:9a:e1 > 00:22:48:56:04:a4, ethertype IPv4 (0x0800), length 66: 3.83.34.110.80 > 10.224.0.6.64252: Flags [S.], seq 3525598602, ack 252952845, win 62727, options [mss 1460,nop,nop,sackOK,nop,wscale 7], length 0
07:38:21.271603 00:22:48:56:04:a4 > 12:34:56:78:9a:bc, ethertype IPv4 (0x0800), length 54: 10.224.0.6.64252 > 3.83.34.110.80: Flags [F.], seq 1, ack 1, win 32, length 0
07:38:21.441450 00:42:68:b1:9a:e1 > 00:22:48:56:04:a4, ethertype IPv4 (0x0800), length 74: 10.244.4.43.42632 > 10.244.24.16.8888: Flags [S], seq 37069585, win 64240, options [mss 1418,sackOK,TS val 1508185741 ecr 0,nop,wscale 7], length 0
07:38:21.441614 00:22:48:56:04:a4 > 12:34:56:78:9a:bc, ethertype IPv4 (0x0800), length 66: 10.244.24.16.8888 > 10.244.4.43.42632: Flags [S.], seq 1032363175, ack 37069586, win 8190, options [mss 1330,nop,wscale 8,nop,nop,sackOK], length 0
07:38:21.447989 00:42:68:b1:9a:e1 > 00:22:48:56:04:a4, ethertype IPv4 (0x0800), length 60: 10.244.4.43.42632 > 10.244.24.16.8888: Flags [.], ack 1, win 502, length 0
07:38:21.448295 00:42:68:b1:9a:e1 > 00:22:48:56:04:a4, ethertype IPv4 (0x0800), length 342: 10.244.4.43.42632 > 10.244.24.16.8888: Flags [P.], seq 1:289, ack 1, win 502, length 288
07:38:21.448555 00:22:48:56:04:a4 > 12:34:56:78:9a:bc, ethertype IPv4 (0x0800), length 54: 10.244.24.16.8888 > 10.244.4.43.42632: Flags [.], ack 289, win 511, length 0
07:38:21.497940 00:42:68:b1:9a:e1 > 00:22:48:56:04:a4, ethertype IPv4 (0x0800), length 60: 3.93.3.247.80 > 10.224.0.6.36589: Flags [F.], seq 1, ack 2, win 491, length 0
07:38:21.498079 00:22:48:56:04:a4 > 12:34:56:78:9a:bc, ethertype IPv4 (0x0800), length 54: 10.224.0.6.36589 > 3.93.3.247.80: Flags [.], ack 2, win 32, length 0
07:38:21.503226 00:42:68:b1:9a:e1 > 00:22:48:56:04:a4, ethertype IPv4 (0x0800), length 60: 3.83.34.110.80 > 10.224.0.6.64252: Flags [F.], seq 1, ack 2, win 491, length 0
07:38:21.503365 00:22:48:56:04:a4 > 12:34:56:78:9a:bc, ethertype IPv4 (0x0800), length 54: 10.224.0.6.64252 > 3.83.34.110.80: Flags [.], ack 2, win 32, length 0
07:38:21.822002 00:22:48:56:04:a4 > 12:34:56:78:9a:bc, ethertype IPv4 (0x0800), length 74: 10.224.0.6.34308 > 169.254.169.254.80: Flags [S], seq 752474841, win 64240, options [mss 1460,sackOK,TS val 2030796825 ecr 0,nop,wscale 7], length 0
07:38:21.822386 12:34:56:78:9a:bc > 00:22:48:56:04:a4, ethertype IPv4 (0x0800), length 74: 169.254.169.254.80 > 10.224.0.6.34308: Flags [S.], seq 1590773414, ack 752474842, win 65535, options [mss 1460,nop,wscale 8,sackOK,TS val 127304768 ecr 2030796825], length 0
07:38:21.822446 00:22:48:56:04:a4 > 12:34:56:78:9a:bc, ethertype IPv4 (0x0800), length 66: 10.224.0.6.34308 > 169.254.169.254.80: Flags [.], ack 1, win 502, options [nop,nop,TS val 2030796825 ecr 127304768], length 0
07:38:21.829646 00:22:48:56:04:a4 > 12:34:56:78:9a:bc, ethertype IPv4 (0x0800), length 207: 10.224.0.6.34308 > 169.254.169.254.80: Flags [P.], seq 1:142, ack 1, win 502, options [nop,nop,TS val 2030796832 ecr 127304768], length 141: HTTP: GET /metadata/scheduledevents?api-version=2020-07-01 HTTP/1.1
07:38:21.837381 12:34:56:78:9a:bc > 00:22:48:56:04:a4, ethertype IPv4 (0x0800), length 319: 169.254.169.254.80 > 10.224.0.6.34308: Flags [P.], seq 1:254, ack 142, win 16387, options [nop,nop,TS val 127304782 ecr 2030796832], length 253: HTTP: HTTP/1.1 200 OK
07:38:21.837456 00:22:48:56:04:a4 > 12:34:56:78:9a:bc, ethertype IPv4 (0x0800), length 66: 10.224.0.6.34308 > 169.254.169.254.80: Flags [.], ack 254, win 501, options [nop,nop,TS val 2030796840 ecr 127304782], length 0
07:38:21.839127 00:22:48:56:04:a4 > 12:34:56:78:9a:bc, ethertype IPv4 (0x0800), length 66: 10.224.0.6.34308 > 169.254.169.254.80: Flags [F.], seq 142, ack 254, win 501, options [nop,nop,TS val 2030796842 ecr 127304782], length 0
07:38:21.839328 12:34:56:78:9a:bc > 00:22:48:56:04:a4, ethertype IPv4 (0x0800), length 66: 169.254.169.254.80 > 10.224.0.6.34308: Flags [F.], seq 254, ack 143, win 16387, options [nop,nop,TS val 127304782 ecr 2030796842], length 0
07:38:21.839346 00:22:48:56:04:a4 > 12:34:56:78:9a:bc, ethertype IPv4 (0x0800), length 66: 10.224.0.6.34308 > 169.254.169.254.80: Flags [.], ack 255, win 501, options [nop,nop,TS val 2030796842 ecr 127304782], length 0
07:38:22.090073 00:22:48:56:04:a4 > 12:34:56:78:9a:bc, ethertype IPv4 (0x0800), length 66: 10.244.24.16.6505 > 10.244.20.6.53: Flags [S], seq 3423906812, win 8188, options [mss 1460,nop,wscale 8,nop,nop,sackOK], length 0
07:38:22.090099 00:22:48:56:04:a4 > 12:34:56:78:9a:bc, ethertype IPv4 (0x0800), length 66: 10.244.24.16.58088 > 10.244.0.174.53: Flags [S], seq 2966223974, win 8188, options [mss 1460,nop,wscale 8,nop,nop,sackOK], length 0
07:38:22.090137 00:22:48:56:04:a4 > 12:34:56:78:9a:bc, ethertype IPv4 (0x0800), length 66: 10.224.0.6.10695 > 20.195.43.37.80: Flags [S], seq 2508541136, win 8188, options [mss 1460,nop,wscale 8,nop,nop,sackOK], length 0
07:38:22.090153 00:22:48:56:04:a4 > 12:34:56:78:9a:bc, ethertype IPv4 (0x0800), length 66: 10.224.0.6.56504 > 104.43.115.6.80: Flags [S], seq 3754242941, win 8188, options [mss 1460,nop,wscale 8,nop,nop,sackOK], length 0
07:38:22.091057 00:42:68:b1:9a:e1 > 00:22:48:56:04:a4, ethertype IPv4 (0x0800), length 66: 10.244.20.6.53 > 10.244.24.16.6505: Flags [S.], seq 3900501915, ack 3423906813, win 64240, options [mss 1418,nop,nop,sackOK,nop,wscale 7], length 0
07:38:22.091141 00:22:48:56:04:a4 > 12:34:56:78:9a:bc, ethertype IPv4 (0x0800), length 54: 10.244.24.16.6505 > 10.244.20.6.53: Flags [F.], seq 1, ack 1, win 32, length 0
07:38:22.091180 00:42:68:b1:9a:e1 > 00:22:48:56:04:a4, ethertype IPv4 (0x0800), length 66: 10.244.0.174.53 > 10.244.24.16.58088: Flags [S.], seq 2909070010, ack 2966223975, win 64240, options [mss 1418,nop,nop,sackOK,nop,wscale 7], length 0
07:38:22.091217 00:22:48:56:04:a4 > 12:34:56:78:9a:bc, ethertype IPv4 (0x0800), length 54: 10.244.24.16.58088 > 10.244.0.174.53: Flags [F.], seq 1, ack 1, win 32, length 0
07:38:22.091451 00:42:68:b1:9a:e1 > 00:22:48:56:04:a4, ethertype IPv4 (0x0800), length 66: 20.195.43.37.80 > 10.224.0.6.10695: Flags [S.], seq 3604138742, ack 2508541137, win 64240, options [mss 1440,nop,nop,sackOK,nop,wscale 7], length 0
07:38:22.091484 00:22:48:56:04:a4 > 12:34:56:78:9a:bc, ethertype IPv4 (0x0800), length 54: 10.224.0.6.10695 > 20.195.43.37.80: Flags [F.], seq 1, ack 1, win 32, length 0
07:38:22.091515 00:42:68:b1:9a:e1 > 00:22:48:56:04:a4, ethertype IPv4 (0x0800), length 66: 104.43.115.6.80 > 10.224.0.6.56504: Flags [S.], seq 995817006, ack 3754242942, win 64240, options [mss 1440,nop,nop,sackOK,nop,wscale 7], length 0
07:38:22.091535 00:42:68:b1:9a:e1 > 00:22:48:56:04:a4, ethertype IPv4 (0x0800), length 60: 10.244.20.6.53 > 10.244.24.16.6505: Flags [F.], seq 1, ack 2, win 502, length 0
07:38:22.091556 00:22:48:56:04:a4 > 12:34:56:78:9a:bc, ethertype IPv4 (0x0800), length 54: 10.224.0.6.56504 > 104.43.115.6.80: Flags [F.], seq 1, ack 1, win 32, length 0
07:38:22.091575 00:22:48:56:04:a4 > 12:34:56:78:9a:bc, ethertype IPv4 (0x0800), length 54: 10.244.24.16.6505 > 10.244.20.6.53: Flags [.], ack 2, win 32, length 0
07:38:22.091737 00:42:68:b1:9a:e1 > 00:22:48:56:04:a4, ethertype IPv4 (0x0800), length 60: 10.244.0.174.53 > 10.244.24.16.58088: Flags [F.], seq 1, ack 2, win 502, length 0
07:38:22.091767 00:22:48:56:04:a4 > 12:34:56:78:9a:bc, ethertype IPv4 (0x0800), length 54: 10.244.24.16.58088 > 10.244.0.174.53: Flags [.], ack 2, win 32, length 0
07:38:22.092421 00:42:68:b1:9a:e1 > 00:22:48:56:04:a4, ethertype IPv4 (0x0800), length 60: 104.43.115.6.80 > 10.224.0.6.56504: Flags [F.], seq 1, ack 2, win 502, length 0
07:38:22.092480 00:22:48:56:04:a4 > 12:34:56:78:9a:bc, ethertype IPv4 (0x0800), length 54: 10.224.0.6.56504 > 104.43.115.6.80: Flags [.], ack 2, win 32, length 0
07:38:22.092544 00:42:68:b1:9a:e1 > 00:22:48:56:04:a4, ethertype IPv4 (0x0800), length 60: 20.195.43.37.80 > 10.224.0.6.10695: Flags [F.], seq 1, ack 2, win 502, length 0
07:38:22.092582 00:22:48:56:04:a4 > 12:34:56:78:9a:bc, ethertype IPv4 (0x0800), length 54: 10.224.0.6.10695 > 20.195.43.37.80: Flags [.], ack 2, win 32, length 0
07:38:22.451699 00:22:48:56:04:a4 > 12:34:56:78:9a:bc, ethertype IPv4 (0x0800), length 71: 10.244.24.16.8888 > 10.244.4.43.42632: Flags [P.], seq 1:18, ack 289, win 511, length 17
07:38:22.451719 00:22:48:56:04:a4 > 12:34:56:78:9a:bc, ethertype IPv4 (0x0800), length 91: 10.244.24.16.8888 > 10.244.4.43.42632: Flags [P.], seq 18:55, ack 289, win 511, length 37
07:38:22.451740 00:22:48:56:04:a4 > 12:34:56:78:9a:bc, ethertype IPv4 (0x0800), length 93: 10.244.24.16.8888 > 10.244.4.43.42632: Flags [P.], seq 55:94, ack 289, win 511, length 39
07:38:22.451754 00:22:48:56:04:a4 > 12:34:56:78:9a:bc, ethertype IPv4 (0x0800), length 154: 10.244.24.16.8888 > 10.244.4.43.42632: Flags [P.], seq 94:194, ack 289, win 511, length 100
07:38:22.451812 00:22:48:56:04:a4 > 12:34:56:78:9a:bc, ethertype IPv4 (0x0800), length 1384: 10.244.24.16.8888 > 10.244.4.43.42632: Flags [.], seq 194:1524, ack 289, win 511, length 1330
07:38:22.451823 00:22:48:56:04:a4 > 12:34:56:78:9a:bc, ethertype IPv4 (0x0800), length 1384: 10.244.24.16.8888 > 10.244.4.43.42632: Flags [.], seq 1524:2854, ack 289, win 511, length 1330
07:38:22.451837 00:22:48:56:04:a4 > 12:34:56:78:9a:bc, ethertype IPv4 (0x0800), length 1384: 10.244.24.16.8888 > 10.244.4.43.42632: Flags [.], seq 2854:4184, ack 289, win 511, length 1330
07:38:22.451850 00:22:48:56:04:a4 > 12:34:56:78:9a:bc, ethertype IPv4 (0x0800), length 1384: 10.244.24.16.8888 > 10.244.4.43.42632: Flags [.], seq 4184:5514, ack 289, win 511, length 1330
07:38:22.451860 00:22:48:56:04:a4 > 12:34:56:78:9a:bc, ethertype IPv4 (0x0800), length 1384: 10.244.24.16.8888 > 10.244.4.43.42632: Flags [P.], seq 5514:6844, ack 289, win 511, length 1330
07:38:22.451869 00:22:48:56:04:a4 > 12:34:56:78:9a:bc, ethertype IPv4 (0x0800), length 1384: 10.244.24.16.8888 > 10.244.4.43.42632: Flags [.], seq 6844:8174, ack 289, win 511, length 1330
07:38:22.451884 00:22:48:56:04:a4 > 12:34:56:78:9a:bc, ethertype IPv4 (0x0800), length 1384: 10.244.24.16.8888 > 10.244.4.43.42632: Flags [.], seq 8174:9504, ack 289, win 511, length 1330
07:38:22.451894 00:22:48:56:04:a4 > 12:34:56:78:9a:bc, ethertype IPv4 (0x0800), length 1384: 10.244.24.16.8888 > 10.244.4.43.42632: Flags [.], seq 9504:10834, ack 289, win 511, length 1330
07:38:22.451903 00:22:48:56:04:a4 > 12:34:56:78:9a:bc, ethertype IPv4 (0x0800), length 1384: 10.244.24.16.8888 > 10.244.4.43.42632: Flags [P.], seq 10834:12164, ack 289, win 511, length 1330
07:38:22.452214 00:42:68:b1:9a:e1 > 00:22:48:56:04:a4, ethertype IPv4 (0x0800), length 60: 10.244.4.43.42632 > 10.244.24.16.8888: Flags [.], ack 18, win 502, length 0
07:38:22.452214 00:42:68:b1:9a:e1 > 00:22:48:56:04:a4, ethertype IPv4 (0x0800), length 60: 10.244.4.43.42632 > 10.244.24.16.8888: Flags [.], ack 55, win 502, length 0
07:38:22.452260 00:42:68:b1:9a:e1 > 00:22:48:56:04:a4, ethertype IPv4 (0x0800), length 60: 10.244.4.43.42632 > 10.244.24.16.8888: Flags [.], ack 94, win 502, length 0
07:38:22.452260 00:42:68:b1:9a:e1 > 00:22:48:56:04:a4, ethertype IPv4 (0x0800), length 60: 10.244.4.43.42632 > 10.244.24.16.8888: Flags [.], ack 194, win 502, length 0
07:38:22.452260 00:42:68:b1:9a:e1 > 00:22:48:56:04:a4, ethertype IPv4 (0x0800), length 60: 10.244.4.43.42632 > 10.244.24.16.8888: Flags [.], ack 1524, win 501, length 0
07:38:22.452276 00:42:68:b1:9a:e1 > 00:22:48:56:04:a4, ethertype IPv4 (0x0800), length 60: 10.244.4.43.42632 > 10.244.24.16.8888: Flags [.], ack 2854, win 497, length 0
07:38:22.452286 00:42:68:b1:9a:e1 > 00:22:48:56:04:a4, ethertype IPv4 (0x0800), length 60: 10.244.4.43.42632 > 10.244.24.16.8888: Flags [.], ack 5514, win 483, length 0
07:38:22.452320 00:42:68:b1:9a:e1 > 00:22:48:56:04:a4, ethertype IPv4 (0x0800), length 60: 10.244.4.43.42632 > 10.244.24.16.8888: Flags [.], ack 6844, win 501, length 0
07:38:22.452320 00:42:68:b1:9a:e1 > 00:22:48:56:04:a4, ethertype IPv4 (0x0800), length 60: 10.244.4.43.42632 > 10.244.24.16.8888: Flags [.], ack 8174, win 497, length 0
07:38:22.452351 00:42:68:b1:9a:e1 > 00:22:48:56:04:a4, ethertype IPv4 (0x0800), length 60: 10.244.4.43.42632 > 10.244.24.16.8888: Flags [.], ack 12164, win 490, length 0
07:38:22.452414 00:22:48:56:04:a4 > 12:34:56:78:9a:bc, ethertype IPv4 (0x0800), length 1384: 10.244.24.16.8888 > 10.244.4.43.42632: Flags [.], seq 12164:13494, ack 289, win 511, length 1330
07:38:22.452432 00:22:48:56:04:a4 > 12:34:56:78:9a:bc, ethertype IPv4 (0x0800), length 1384: 10.244.24.16.8888 > 10.244.4.43.42632: Flags [.], seq 13494:14824, ack 289, win 511, length 1330
07:38:22.452453 00:22:48:56:04:a4 > 12:34:56:78:9a:bc, ethertype IPv4 (0x0800), length 1384: 10.244.24.16.8888 > 10.244.4.43.42632: Flags [.], seq 14824:16154, ack 289, win 511, length 1330
07:38:22.452463 00:22:48:56:04:a4 > 12:34:56:78:9a:bc, ethertype IPv4 (0x0800), length 1384: 10.244.24.16.8888 > 10.244.4.43.42632: Flags [P.], seq 16154:17484, ack 289, win 511, length 1330
07:38:22.452501 00:22:48:56:04:a4 > 12:34:56:78:9a:bc, ethertype IPv4 (0x0800), length 1384: 10.244.24.16.8888 > 10.244.4.43.42632: Flags [.], seq 17484:18814, ack 289, win 511, length 1330
07:38:22.452511 00:22:48:56:04:a4 > 12:34:56:78:9a:bc, ethertype IPv4 (0x0800), length 1384: 10.244.24.16.8888 > 10.244.4.43.42632: Flags [.], seq 18814:20144, ack 289, win 511, length 1330
07:38:22.452521 00:22:48:56:04:a4 > 12:34:56:78:9a:bc, ethertype IPv4 (0x0800), length 1384: 10.244.24.16.8888 > 10.244.4.43.42632: Flags [.], seq 20144:21474, ack 289, win 511, length 1330
07:38:22.452536 00:22:48:56:04:a4 > 12:34:56:78:9a:bc, ethertype IPv4 (0x0800), length 1384: 10.244.24.16.8888 > 10.244.4.43.42632: Flags [P.], seq 21474:22804, ack 289, win 511, length 1330
07:38:22.452546 00:22:48:56:04:a4 > 12:34:56:78:9a:bc, ethertype IPv4 (0x0800), length 1384: 10.244.24.16.8888 > 10.244.4.43.42632: Flags [.], seq 22804:24134, ack 289, win 511, length 1330
07:38:22.452555 00:22:48:56:04:a4 > 12:34:56:78:9a:bc, ethertype IPv4 (0x0800), length 1384: 10.244.24.16.8888 > 10.244.4.43.42632: Flags [.], seq 24134:25464, ack 289, win 511, length 1330
07:38:22.452569 00:22:48:56:04:a4 > 12:34:56:78:9a:bc, ethertype IPv4 (0x0800), length 1384: 10.244.24.16.8888 > 10.244.4.43.42632: Flags [P.], seq 25464:26794, ack 289, win 511, length 1330
07:38:22.452874 00:42:68:b1:9a:e1 > 00:22:48:56:04:a4, ethertype IPv4 (0x0800), length 60: 10.244.4.43.42632 > 10.244.24.16.8888: Flags [.], ack 13494, win 501, length 0
07:38:22.452893 00:42:68:b1:9a:e1 > 00:22:48:56:04:a4, ethertype IPv4 (0x0800), length 60: 10.244.4.43.42632 > 10.244.24.16.8888: Flags [.], ack 16154, win 482, length 0
07:38:22.452916 00:42:68:b1:9a:e1 > 00:22:48:56:04:a4, ethertype IPv4 (0x0800), length 60: 10.244.4.43.42632 > 10.244.24.16.8888: Flags [.], ack 17484, win 490, length 0
07:38:22.452944 00:42:68:b1:9a:e1 > 00:22:48:56:04:a4, ethertype IPv4 (0x0800), length 60: 10.244.4.43.42632 > 10.244.24.16.8888: Flags [.], ack 18814, win 501, length 0
07:38:22.452968 00:42:68:b1:9a:e1 > 00:22:48:56:04:a4, ethertype IPv4 (0x0800), length 60: 10.244.4.43.42632 > 10.244.24.16.8888: Flags [.], ack 21474, win 497, length 0
07:38:22.452984 00:22:48:56:04:a4 > 12:34:56:78:9a:bc, ethertype IPv4 (0x0800), length 1384: 10.244.24.16.8888 > 10.244.4.43.42632: Flags [.], seq 26794:28124, ack 289, win 511, length 1330
07:38:22.452995 00:22:48:56:04:a4 > 12:34:56:78:9a:bc, ethertype IPv4 (0x0800), length 1384: 10.244.24.16.8888 > 10.244.4.43.42632: Flags [.], seq 28124:29454, ack 289, win 511, length 1330
07:38:22.453001 00:42:68:b1:9a:e1 > 00:22:48:56:04:a4, ethertype IPv4 (0x0800), length 60: 10.244.4.43.42632 > 10.244.24.16.8888: Flags [.], ack 22804, win 501, length 0
07:38:22.453012 00:22:48:56:04:a4 > 12:34:56:78:9a:bc, ethertype IPv4 (0x0800), length 1384: 10.244.24.16.8888 > 10.244.4.43.42632: Flags [.], seq 29454:30784, ack 289, win 511, length 1330
07:38:22.453023 00:42:68:b1:9a:e1 > 00:22:48:56:04:a4, ethertype IPv4 (0x0800), length 60: 10.244.4.43.42632 > 10.244.24.16.8888: Flags [.], ack 25464, win 501, length 0
07:38:22.453026 00:22:48:56:04:a4 > 12:34:56:78:9a:bc, ethertype IPv4 (0x0800), length 1384: 10.244.24.16.8888 > 10.244.4.43.42632: Flags [P.], seq 30784:32114, ack 289, win 511, length 1330
07:38:22.453094 00:22:48:56:04:a4 > 12:34:56:78:9a:bc, ethertype IPv4 (0x0800), length 1384: 10.244.24.16.8888 > 10.244.4.43.42632: Flags [.], seq 32114:33444, ack 289, win 511, length 1330
07:38:22.453104 00:22:48:56:04:a4 > 12:34:56:78:9a:bc, ethertype IPv4 (0x0800), length 1384: 10.244.24.16.8888 > 10.244.4.43.42632: Flags [.], seq 33444:34774, ack 289, win 511, length 1330
07:38:22.453114 00:22:48:56:04:a4 > 12:34:56:78:9a:bc, ethertype IPv4 (0x0800), length 1384: 10.244.24.16.8888 > 10.244.4.43.42632: Flags [.], seq 34774:36104, ack 289, win 511, length 1330
07:38:22.453130 00:22:48:56:04:a4 > 12:34:56:78:9a:bc, ethertype IPv4 (0x0800), length 1384: 10.244.24.16.8888 > 10.244.4.43.42632: Flags [P.], seq 36104:37434, ack 289, win 511, length 1330
07:38:22.453441 00:42:68:b1:9a:e1 > 00:22:48:56:04:a4, ethertype IPv4 (0x0800), length 60: 10.244.4.43.42632 > 10.244.24.16.8888: Flags [.], ack 28124, win 501, length 0
07:38:22.453482 00:42:68:b1:9a:e1 > 00:22:48:56:04:a4, ethertype IPv4 (0x0800), length 60: 10.244.4.43.42632 > 10.244.24.16.8888: Flags [.], ack 30784, win 501, length 0
07:38:22.453549 00:42:68:b1:9a:e1 > 00:22:48:56:04:a4, ethertype IPv4 (0x0800), length 60: 10.244.4.43.42632 > 10.244.24.16.8888: Flags [.], ack 33444, win 501, length 0
07:38:22.453568 00:22:48:56:04:a4 > 12:34:56:78:9a:bc, ethertype IPv4 (0x0800), length 1384: 10.244.24.16.8888 > 10.244.4.43.42632: Flags [.], seq 37434:38764, ack 289, win 511, length 1330
07:38:22.453581 00:22:48:56:04:a4 > 12:34:56:78:9a:bc, ethertype IPv4 (0x0800), length 1384: 10.244.24.16.8888 > 10.244.4.43.42632: Flags [.], seq 38764:40094, ack 289, win 511, length 1330
07:38:22.453591 00:22:48:56:04:a4 > 12:34:56:78:9a:bc, ethertype IPv4 (0x0800), length 1384: 10.244.24.16.8888 > 10.244.4.43.42632: Flags [.], seq 40094:41424, ack 289, win 511, length 1330
07:38:22.453608 00:22:48:56:04:a4 > 12:34:56:78:9a:bc, ethertype IPv4 (0x0800), length 1384: 10.244.24.16.8888 > 10.244.4.43.42632: Flags [.], seq 41424:42754, ack 289, win 511, length 1330
07:38:22.453618 00:22:48:56:04:a4 > 12:34:56:78:9a:bc, ethertype IPv4 (0x0800), length 1384: 10.244.24.16.8888 > 10.244.4.43.42632: Flags [P.], seq 42754:44084, ack 289, win 511, length 1330
07:38:22.453676 00:22:48:56:04:a4 > 12:34:56:78:9a:bc, ethertype IPv4 (0x0800), length 1384: 10.244.24.16.8888 > 10.244.4.43.42632: Flags [.], seq 44084:45414, ack 289, win 511, length 1330
07:38:22.453686 00:22:48:56:04:a4 > 12:34:56:78:9a:bc, ethertype IPv4 (0x0800), length 1384: 10.244.24.16.8888 > 10.244.4.43.42632: Flags [.], seq 45414:46744, ack 289, win 511, length 1330
07:38:22.453696 00:22:48:56:04:a4 > 12:34:56:78:9a:bc, ethertype IPv4 (0x0800), length 1384: 10.244.24.16.8888 > 10.244.4.43.42632: Flags [.], seq 46744:48074, ack 289, win 511, length 1330
07:38:22.453712 00:22:48:56:04:a4 > 12:34:56:78:9a:bc, ethertype IPv4 (0x0800), length 1384: 10.244.24.16.8888 > 10.244.4.43.42632: Flags [P.], seq 48074:49404, ack 289, win 511, length 1330
07:38:22.455429 00:42:68:b1:9a:e1 > 00:22:48:56:04:a4, ethertype IPv4 (0x0800), length 60: 10.244.4.43.42632 > 10.244.24.16.8888: Flags [.], ack 49404, win 501, length 0
07:38:22.455549 00:22:48:56:04:a4 > 12:34:56:78:9a:bc, ethertype IPv4 (0x0800), length 1384: 10.244.24.16.8888 > 10.244.4.43.42632: Flags [.], seq 49404:50734, ack 289, win 511, length 1330
07:38:22.455560 00:22:48:56:04:a4 > 12:34:56:78:9a:bc, ethertype IPv4 (0x0800), length 1384: 10.244.24.16.8888 > 10.244.4.43.42632: Flags [.], seq 50734:52064, ack 289, win 511, length 1330
07:38:22.455570 00:22:48:56:04:a4 > 12:34:56:78:9a:bc, ethertype IPv4 (0x0800), length 1384: 10.244.24.16.8888 > 10.244.4.43.42632: Flags [.], seq 52064:53394, ack 289, win 511, length 1330
07:38:22.455588 00:22:48:56:04:a4 > 12:34:56:78:9a:bc, ethertype IPv4 (0x0800), length 1384: 10.244.24.16.8888 > 10.244.4.43.42632: Flags [.], seq 53394:54724, ack 289, win 511, length 1330
07:38:22.455598 00:22:48:56:04:a4 > 12:34:56:78:9a:bc, ethertype IPv4 (0x0800), length 1384: 10.244.24.16.8888 > 10.244.4.43.42632: Flags [.], seq 54724:56054, ack 289, win 511, length 1330
07:38:22.455607 00:22:48:56:04:a4 > 12:34:56:78:9a:bc, ethertype IPv4 (0x0800), length 1384: 10.244.24.16.8888 > 10.244.4.43.42632: Flags [P.], seq 56054:57384, ack 289, win 511, length 1330
07:38:22.455622 00:22:48:56:04:a4 > 12:34:56:78:9a:bc, ethertype IPv4 (0x0800), length 1384: 10.244.24.16.8888 > 10.244.4.43.42632: Flags [.], seq 57384:58714, ack 289, win 511, length 1330
07:38:22.455632 00:22:48:56:04:a4 > 12:34:56:78:9a:bc, ethertype IPv4 (0x0800), length 1384: 10.244.24.16.8888 > 10.244.4.43.42632: Flags [.], seq 58714:60044, ack 289, win 511, length 1330
07:38:22.455641 00:22:48:56:04:a4 > 12:34:56:78:9a:bc, ethertype IPv4 (0x0800), length 1384: 10.244.24.16.8888 > 10.244.4.43.42632: Flags [.], seq 60044:61374, ack 289, win 511, length 1330
07:38:22.455655 00:22:48:56:04:a4 > 12:34:56:78:9a:bc, ethertype IPv4 (0x0800), length 1384: 10.244.24.16.8888 > 10.244.4.43.42632: Flags [.], seq 61374:62704, ack 289, win 511, length 1330
07:38:22.455664 00:22:48:56:04:a4 > 12:34:56:78:9a:bc, ethertype IPv4 (0x0800), length 1384: 10.244.24.16.8888 > 10.244.4.43.42632: Flags [.], seq 62704:64034, ack 289, win 511, length 1330
07:38:22.455674 00:22:48:56:04:a4 > 12:34:56:78:9a:bc, ethertype IPv4 (0x0800), length 1384: 10.244.24.16.8888 > 10.244.4.43.42632: Flags [P.], seq 64034:65364, ack 289, win 511, length 1330
07:38:22.456160 00:42:68:b1:9a:e1 > 00:22:48:56:04:a4, ethertype IPv4 (0x0800), length 60: 10.244.4.43.42632 > 10.244.24.16.8888: Flags [.], ack 65364, win 501, length 0
07:38:22.456269 00:22:48:56:04:a4 > 12:34:56:78:9a:bc, ethertype IPv4 (0x0800), length 1384: 10.244.24.16.8888 > 10.244.4.43.42632: Flags [.], seq 65364:66694, ack 289, win 511, length 1330
07:38:22.456280 00:22:48:56:04:a4 > 12:34:56:78:9a:bc, ethertype IPv4 (0x0800), length 1384: 10.244.24.16.8888 > 10.244.4.43.42632: Flags [.], seq 66694:68024, ack 289, win 511, length 1330
07:38:22.456290 00:22:48:56:04:a4 > 12:34:56:78:9a:bc, ethertype IPv4 (0x0800), length 1384: 10.244.24.16.8888 > 10.244.4.43.42632: Flags [.], seq 68024:69354, ack 289, win 511, length 1330
07:38:22.456307 00:22:48:56:04:a4 > 12:34:56:78:9a:bc, ethertype IPv4 (0x0800), length 1384: 10.244.24.16.8888 > 10.244.4.43.42632: Flags [.], seq 69354:70684, ack 289, win 511, length 1330
07:38:22.456317 00:22:48:56:04:a4 > 12:34:56:78:9a:bc, ethertype IPv4 (0x0800), length 1384: 10.244.24.16.8888 > 10.244.4.43.42632: Flags [.], seq 70684:72014, ack 289, win 511, length 1330
07:38:22.456326 00:22:48:56:04:a4 > 12:34:56:78:9a:bc, ethertype IPv4 (0x0800), length 1384: 10.244.24.16.8888 > 10.244.4.43.42632: Flags [P.], seq 72014:73344, ack 289, win 511, length 1330
07:38:22.456341 00:22:48:56:04:a4 > 12:34:56:78:9a:bc, ethertype IPv4 (0x0800), length 1384: 10.244.24.16.8888 > 10.244.4.43.42632: Flags [.], seq 73344:74674, ack 289, win 511, length 1330
07:38:22.456350 00:22:48:56:04:a4 > 12:34:56:78:9a:bc, ethertype IPv4 (0x0800), length 1384: 10.244.24.16.8888 > 10.244.4.43.42632: Flags [.], seq 74674:76004, ack 289, win 511, length 1330
07:38:22.456360 00:22:48:56:04:a4 > 12:34:56:78:9a:bc, ethertype IPv4 (0x0800), length 1384: 10.244.24.16.8888 > 10.244.4.43.42632: Flags [.], seq 76004:77334, ack 289, win 511, length 1330
07:38:22.456374 00:22:48:56:04:a4 > 12:34:56:78:9a:bc, ethertype IPv4 (0x0800), length 1384: 10.244.24.16.8888 > 10.244.4.43.42632: Flags [.], seq 77334:78664, ack 289, win 511, length 1330
07:38:22.456383 00:22:48:56:04:a4 > 12:34:56:78:9a:bc, ethertype IPv4 (0x0800), length 1384: 10.244.24.16.8888 > 10.244.4.43.42632: Flags [.], seq 78664:79994, ack 289, win 511, length 1330
07:38:22.456393 00:22:48:56:04:a4 > 12:34:56:78:9a:bc, ethertype IPv4 (0x0800), length 1384: 10.244.24.16.8888 > 10.244.4.43.42632: Flags [P.], seq 79994:81324, ack 289, win 511, length 1330
07:38:22.456407 00:22:48:56:04:a4 > 12:34:56:78:9a:bc, ethertype IPv4 (0x0800), length 1384: 10.244.24.16.8888 > 10.244.4.43.42632: Flags [.], seq 81324:82654, ack 289, win 511, length 1330
07:38:22.456733 00:42:68:b1:9a:e1 > 00:22:48:56:04:a4, ethertype IPv4 (0x0800), length 60: 10.244.4.43.42632 > 10.244.24.16.8888: Flags [.], ack 68024, win 543, length 0
07:38:22.456750 00:42:68:b1:9a:e1 > 00:22:48:56:04:a4, ethertype IPv4 (0x0800), length 60: 10.244.4.43.42632 > 10.244.24.16.8888: Flags [.], ack 72014, win 605, length 0
07:38:22.456800 00:42:68:b1:9a:e1 > 00:22:48:56:04:a4, ethertype IPv4 (0x0800), length 60: 10.244.4.43.42632 > 10.244.24.16.8888: Flags [.], ack 73344, win 628, length 0
07:38:22.456800 00:42:68:b1:9a:e1 > 00:22:48:56:04:a4, ethertype IPv4 (0x0800), length 60: 10.244.4.43.42632 > 10.244.24.16.8888: Flags [.], ack 74674, win 651, length 0
07:38:22.456810 00:22:48:56:04:a4 > 12:34:56:78:9a:bc, ethertype IPv4 (0x0800), length 1384: 10.244.24.16.8888 > 10.244.4.43.42632: Flags [.], seq 82654:83984, ack 289, win 511, length 1330
07:38:22.456822 00:42:68:b1:9a:e1 > 00:22:48:56:04:a4, ethertype IPv4 (0x0800), length 60: 10.244.4.43.42632 > 10.244.24.16.8888: Flags [.], ack 79994, win 734, length 0
07:38:22.456823 00:22:48:56:04:a4 > 12:34:56:78:9a:bc, ethertype IPv4 (0x0800), length 1384: 10.244.24.16.8888 > 10.244.4.43.42632: Flags [.], seq 83984:85314, ack 289, win 511, length 1330
07:38:22.456840 00:22:48:56:04:a4 > 12:34:56:78:9a:bc, ethertype IPv4 (0x0800), length 1384: 10.244.24.16.8888 > 10.244.4.43.42632: Flags [.], seq 85314:86644, ack 289, win 511, length 1330
07:38:22.456846 00:42:68:b1:9a:e1 > 00:22:48:56:04:a4, ethertype IPv4 (0x0800), length 60: 10.244.4.43.42632 > 10.244.24.16.8888: Flags [.], ack 81324, win 757, length 0
07:38:22.456846 00:42:68:b1:9a:e1 > 00:22:48:56:04:a4, ethertype IPv4 (0x0800), length 60: 10.244.4.43.42632 > 10.244.24.16.8888: Flags [.], ack 82654, win 779, length 0
07:38:22.456852 00:22:48:56:04:a4 > 12:34:56:78:9a:bc, ethertype IPv4 (0x0800), length 1384: 10.244.24.16.8888 > 10.244.4.43.42632: Flags [.], seq 86644:87974, ack 289, win 511, length 1330
07:38:22.456861 00:22:48:56:04:a4 > 12:34:56:78:9a:bc, ethertype IPv4 (0x0800), length 1384: 10.244.24.16.8888 > 10.244.4.43.42632: Flags [P.], seq 87974:89304, ack 289, win 511, length 1330
07:38:22.456975 00:22:48:56:04:a4 > 12:34:56:78:9a:bc, ethertype IPv4 (0x0800), length 1384: 10.244.24.16.8888 > 10.244.4.43.42632: Flags [.], seq 89304:90634, ack 289, win 511, length 1330
07:38:22.456986 00:22:48:56:04:a4 > 12:34:56:78:9a:bc, ethertype IPv4 (0x0800), length 1384: 10.244.24.16.8888 > 10.244.4.43.42632: Flags [.], seq 90634:91964, ack 289, win 511, length 1330
07:38:22.456995 00:22:48:56:04:a4 > 12:34:56:78:9a:bc, ethertype IPv4 (0x0800), length 1384: 10.244.24.16.8888 > 10.244.4.43.42632: Flags [.], seq 91964:93294, ack 289, win 511, length 1330
07:38:22.457012 00:22:48:56:04:a4 > 12:34:56:78:9a:bc, ethertype IPv4 (0x0800), length 1384: 10.244.24.16.8888 > 10.244.4.43.42632: Flags [.], seq 93294:94624, ack 289, win 511, length 1330
07:38:22.457021 00:22:48:56:04:a4 > 12:34:56:78:9a:bc, ethertype IPv4 (0x0800), length 1384: 10.244.24.16.8888 > 10.244.4.43.42632: Flags [.], seq 94624:95954, ack 289, win 511, length 1330
07:38:22.457031 00:22:48:56:04:a4 > 12:34:56:78:9a:bc, ethertype IPv4 (0x0800), length 1384: 10.244.24.16.8888 > 10.244.4.43.42632: Flags [.], seq 95954:97284, ack 289, win 511, length 1330
07:38:22.457045 00:22:48:56:04:a4 > 12:34:56:78:9a:bc, ethertype IPv4 (0x0800), length 1384: 10.244.24.16.8888 > 10.244.4.43.42632: Flags [P.], seq 97284:98614, ack 289, win 511, length 1330
07:38:22.457054 00:22:48:56:04:a4 > 12:34:56:78:9a:bc, ethertype IPv4 (0x0800), length 1384: 10.244.24.16.8888 > 10.244.4.43.42632: Flags [.], seq 98614:99944, ack 289, win 511, length 1330
07:38:22.457064 00:22:48:56:04:a4 > 12:34:56:78:9a:bc, ethertype IPv4 (0x0800), length 1384: 10.244.24.16.8888 > 10.244.4.43.42632: Flags [P.], seq 99944:101274, ack 289, win 511, length 1330
07:38:22.457246 00:42:68:b1:9a:e1 > 00:22:48:56:04:a4, ethertype IPv4 (0x0800), length 60: 10.244.4.43.42632 > 10.244.24.16.8888: Flags [.], ack 83984, win 802, length 0
07:38:22.457309 00:42:68:b1:9a:e1 > 00:22:48:56:04:a4, ethertype IPv4 (0x0800), length 60: 10.244.4.43.42632 > 10.244.24.16.8888: Flags [.], ack 89304, win 885, length 0
07:38:22.457383 00:22:48:56:04:a4 > 12:34:56:78:9a:bc, ethertype IPv4 (0x0800), length 1384: 10.244.24.16.8888 > 10.244.4.43.42632: Flags [.], seq 101274:102604, ack 289, win 511, length 1330
07:38:22.457413 00:42:68:b1:9a:e1 > 00:22:48:56:04:a4, ethertype IPv4 (0x0800), length 60: 10.244.4.43.42632 > 10.244.24.16.8888: Flags [.], ack 90634, win 908, length 0
07:38:22.457418 00:22:48:56:04:a4 > 12:34:56:78:9a:bc, ethertype IPv4 (0x0800), length 1384: 10.244.24.16.8888 > 10.244.4.43.42632: Flags [.], seq 102604:103934, ack 289, win 511, length 1330
07:38:22.457431 00:22:48:56:04:a4 > 12:34:56:78:9a:bc, ethertype IPv4 (0x0800), length 1384: 10.244.24.16.8888 > 10.244.4.43.42632: Flags [.], seq 103934:105264, ack 289, win 511, length 1330
07:38:22.457443 00:22:48:56:04:a4 > 12:34:56:78:9a:bc, ethertype IPv4 (0x0800), length 1384: 10.244.24.16.8888 > 10.244.4.43.42632: Flags [.], seq 105264:106594, ack 289, win 511, length 1330
07:38:22.457445 00:42:68:b1:9a:e1 > 00:22:48:56:04:a4, ethertype IPv4 (0x0800), length 60: 10.244.4.43.42632 > 10.244.24.16.8888: Flags [.], ack 94624, win 970, length 0
07:38:22.457457 00:22:48:56:04:a4 > 12:34:56:78:9a:bc, ethertype IPv4 (0x0800), length 1384: 10.244.24.16.8888 > 10.244.4.43.42632: Flags [P.], seq 106594:107924, ack 289, win 511, length 1330
07:38:22.457464 00:42:68:b1:9a:e1 > 00:22:48:56:04:a4, ethertype IPv4 (0x0800), length 60: 10.244.4.43.42632 > 10.244.24.16.8888: Flags [.], ack 95954, win 993, length 0
07:38:22.457537 00:42:68:b1:9a:e1 > 00:22:48:56:04:a4, ethertype IPv4 (0x0800), length 60: 10.244.4.43.42632 > 10.244.24.16.8888: Flags [.], ack 97284, win 1016, length 0
07:38:22.457559 00:42:68:b1:9a:e1 > 00:22:48:56:04:a4, ethertype IPv4 (0x0800), length 60: 10.244.4.43.42632 > 10.244.24.16.8888: Flags [.], ack 98614, win 1039, length 0
07:38:22.457559 00:42:68:b1:9a:e1 > 00:22:48:56:04:a4, ethertype IPv4 (0x0800), length 60: 10.244.4.43.42632 > 10.244.24.16.8888: Flags [.], ack 101274, win 1080, length 0
07:38:22.457584 00:22:48:56:04:a4 > 12:34:56:78:9a:bc, ethertype IPv4 (0x0800), length 1384: 10.244.24.16.8888 > 10.244.4.43.42632: Flags [.], seq 107924:109254, ack 289, win 511, length 1330
07:38:22.457595 00:22:48:56:04:a4 > 12:34:56:78:9a:bc, ethertype IPv4 (0x0800), length 1384: 10.244.24.16.8888 > 10.244.4.43.42632: Flags [.], seq 109254:110584, ack 289, win 511, length 1330
07:38:22.457604 00:22:48:56:04:a4 > 12:34:56:78:9a:bc, ethertype IPv4 (0x0800), length 1384: 10.244.24.16.8888 > 10.244.4.43.42632: Flags [.], seq 110584:111914, ack 289, win 511, length 1330
07:38:22.457621 00:22:48:56:04:a4 > 12:34:56:78:9a:bc, ethertype IPv4 (0x0800), length 1384: 10.244.24.16.8888 > 10.244.4.43.42632: Flags [P.], seq 111914:113244, ack 289, win 511, length 1330
07:38:22.457687 00:22:48:56:04:a4 > 12:34:56:78:9a:bc, ethertype IPv4 (0x0800), length 1384: 10.244.24.16.8888 > 10.244.4.43.42632: Flags [.], seq 113244:114574, ack 289, win 511, length 1330
07:38:22.457698 00:22:48:56:04:a4 > 12:34:56:78:9a:bc, ethertype IPv4 (0x0800), length 1384: 10.244.24.16.8888 > 10.244.4.43.42632: Flags [.], seq 114574:115904, ack 289, win 511, length 1330
