07:26:58.103788 12:34:56:78:9a:bc > 00:22:48:56:04:a4, ethertype IPv4 (0x0800), length 74: 125.22.100.227.46480 > 20.212.124.152.443: Flags [S], seq 1456191783, win 29200, options [mss 1460,sackOK,TS val 1872833276 ecr 0,nop,wscale 7], length 0
07:26:58.103788 12:34:56:78:9a:bc > 00:22:48:56:04:a4, ethertype IPv4 (0x0800), length 74: 125.22.100.227.46484 > 20.212.124.152.443: Flags [S], seq 2510541382, win 29200, options [mss 1460,sackOK,TS val 1872833276 ecr 0,nop,wscale 7], length 0
07:26:58.103929 00:22:48:56:04:a4 > 12:34:56:78:9a:bc, ethertype IPv4 (0x0800), length 66: 20.212.124.152.443 > 125.22.100.227.46480: Flags [S.], seq 974875895, ack 1456191784, win 8190, options [mss 1460,nop,wscale 8,nop,nop,sackOK], length 0
07:26:58.103940 00:22:48:56:04:a4 > 12:34:56:78:9a:bc, ethertype IPv4 (0x0800), length 66: 20.212.124.152.443 > 125.22.100.227.46484: Flags [S.], seq 3543230443, ack 2510541383, win 8190, options [mss 1460,nop,wscale 8,nop,nop,sackOK], length 0
07:26:58.103955 12:34:56:78:9a:bc > 00:22:48:56:04:a4, ethertype IPv4 (0x0800), length 74: 125.22.100.227.46498 > 20.212.124.152.443: Flags [S], seq 365521654, win 29200, options [mss 1460,sackOK,TS val 1872833276 ecr 0,nop,wscale 7], length 0
07:26:58.104018 12:34:56:78:9a:bc > 00:22:48:56:04:a4, ethertype IPv4 (0x0800), length 74: 125.22.100.227.46496 > 20.212.124.152.443: Flags [S], seq 3712796207, win 29200, options [mss 1460,sackOK,TS val 1872833276 ecr 0,nop,wscale 7], length 0
07:26:58.104064 00:22:48:56:04:a4 > 12:34:56:78:9a:bc, ethertype IPv4 (0x0800), length 66: 20.212.124.152.443 > 125.22.100.227.46498: Flags [S.], seq 3898592476, ack 365521655, win 8190, options [mss 1460,nop,wscale 8,nop,nop,sackOK], length 0
07:26:58.104069 00:22:48:56:04:a4 > 12:34:56:78:9a:bc, ethertype IPv4 (0x0800), length 66: 20.212.124.152.443 > 125.22.100.227.46496: Flags [S.], seq 914964851, ack 3712796208, win 8190, options [mss 1460,nop,wscale 8,nop,nop,sackOK], length 0
07:26:58.104206 12:34:56:78:9a:bc > 00:22:48:56:04:a4, ethertype IPv4 (0x0800), length 74: 125.22.100.227.46490 > 20.212.124.152.443: Flags [S], seq 3044880656, win 29200, options [mss 1460,sackOK,TS val 1872833276 ecr 0,nop,wscale 7], length 0
07:26:58.104214 12:34:56:78:9a:bc > 00:22:48:56:04:a4, ethertype IPv4 (0x0800), length 74: 125.22.100.227.46538 > 20.212.124.152.443: Flags [S], seq 1263376542, win 29200, options [mss 1460,sackOK,TS val 1872833276 ecr 0,nop,wscale 7], length 0
07:26:58.104246 12:34:56:78:9a:bc > 00:22:48:56:04:a4, ethertype IPv4 (0x0800), length 74: 125.22.100.227.46528 > 20.212.124.152.443: Flags [S], seq 3461256938, win 29200, options [mss 1460,sackOK,TS val 1872833276 ecr 0,nop,wscale 7], length 0
07:26:58.104258 00:22:48:56:04:a4 > 12:34:56:78:9a:bc, ethertype IPv4 (0x0800), length 66: 20.212.124.152.443 > 125.22.100.227.46490: Flags [S.], seq 3726232670, ack 3044880657, win 8190, options [mss 1460,nop,wscale 8,nop,nop,sackOK], length 0
07:26:58.104272 00:22:48:56:04:a4 > 12:34:56:78:9a:bc, ethertype IPv4 (0x0800), length 66: 20.212.124.152.443 > 125.22.100.227.46528: Flags [S.], seq 3332163113, ack 3461256939, win 8190, options [mss 1460,nop,wscale 8,nop,nop,sackOK], length 0
07:26:58.104287 00:22:48:56:04:a4 > 12:34:56:78:9a:bc, ethertype IPv4 (0x0800), length 66: 20.212.124.152.443 > 125.22.100.227.46538: Flags [S.], seq 2425675378, ack 1263376543, win 8190, options [mss 1460,nop,wscale 8,nop,nop,sackOK], length 0
07:26:58.104637 12:34:56:78:9a:bc > 00:22:48:56:04:a4, ethertype IPv4 (0x0800), length 74: 125.22.100.227.46516 > 20.212.124.152.443: Flags [S], seq 3895263330, win 29200, options [mss 1460,sackOK,TS val 1872833276 ecr 0,nop,wscale 7], length 0
07:26:58.104680 00:22:48:56:04:a4 > 12:34:56:78:9a:bc, ethertype IPv4 (0x0800), length 66: 20.212.124.152.443 > 125.22.100.227.46516: Flags [S.], seq 1626028063, ack 3895263331, win 8190, options [mss 1460,nop,wscale 8,nop,nop,sackOK], length 0
07:26:58.104700 12:34:56:78:9a:bc > 00:22:48:56:04:a4, ethertype IPv4 (0x0800), length 74: 125.22.100.227.46568 > 20.212.124.152.443: Flags [S], seq 227158237, win 29200, options [mss 1460,sackOK,TS val 1872833276 ecr 0,nop,wscale 7], length 0
07:26:58.104700 12:34:56:78:9a:bc > 00:22:48:56:04:a4, ethertype IPv4 (0x0800), length 74: 125.22.100.227.46532 > 20.212.124.152.443: Flags [S], seq 901424908, win 29200, options [mss 1460,sackOK,TS val 1872833276 ecr 0,nop,wscale 7], length 0
07:26:58.104702 12:34:56:78:9a:bc > 00:22:48:56:04:a4, ethertype IPv4 (0x0800), length 74: 125.22.100.227.46550 > 20.212.124.152.443: Flags [S], seq 3526485214, win 29200, options [mss 1460,sackOK,TS val 1872833276 ecr 0,nop,wscale 7], length 0
07:26:58.104709 12:34:56:78:9a:bc > 00:22:48:56:04:a4, ethertype IPv4 (0x0800), length 74: 125.22.100.227.46506 > 20.212.124.152.443: Flags [S], seq 2034955697, win 29200, options [mss 1460,sackOK,TS val 1872833276 ecr 0,nop,wscale 7], length 0
07:26:58.104749 12:34:56:78:9a:bc > 00:22:48:56:04:a4, ethertype IPv4 (0x0800), length 74: 125.22.100.227.46510 > 20.212.124.152.443: Flags [S], seq 671043304, win 29200, options [mss 1460,sackOK,TS val 1872833276 ecr 0,nop,wscale 7], length 0
07:26:58.104760 00:22:48:56:04:a4 > 12:34:56:78:9a:bc, ethertype IPv4 (0x0800), length 66: 20.212.124.152.443 > 125.22.100.227.46550: Flags [S.], seq 1311976010, ack 3526485215, win 8190, options [mss 1460,nop,wscale 8,nop,nop,sackOK], length 0
07:26:58.104777 00:22:48:56:04:a4 > 12:34:56:78:9a:bc, ethertype IPv4 (0x0800), length 66: 20.212.124.152.443 > 125.22.100.227.46568: Flags [S.], seq 1067283001, ack 227158238, win 8190, options [mss 1460,nop,wscale 8,nop,nop,sackOK], length 0
07:26:58.104783 00:22:48:56:04:a4 > 12:34:56:78:9a:bc, ethertype IPv4 (0x0800), length 66: 20.212.124.152.443 > 125.22.100.227.46506: Flags [S.], seq 2277833001, ack 2034955698, win 8190, options [mss 1460,nop,wscale 8,nop,nop,sackOK], length 0
07:26:58.104788 12:34:56:78:9a:bc > 00:22:48:56:04:a4, ethertype IPv4 (0x0800), length 74: 125.22.100.227.46500 > 20.212.124.152.443: Flags [S], seq 2936548120, win 29200, options [mss 1460,sackOK,TS val 1872833276 ecr 0,nop,wscale 7], length 0
07:26:58.104788 12:34:56:78:9a:bc > 00:22:48:56:04:a4, ethertype IPv4 (0x0800), length 74: 125.22.100.227.46504 > 20.212.124.152.443: Flags [S], seq 3302277036, win 29200, options [mss 1460,sackOK,TS val 1872833276 ecr 0,nop,wscale 7], length 0
07:26:58.104809 00:22:48:56:04:a4 > 12:34:56:78:9a:bc, ethertype IPv4 (0x0800), length 66: 20.212.124.152.443 > 125.22.100.227.46510: Flags [S.], seq 1561324330, ack 671043305, win 8190, options [mss 1460,nop,wscale 8,nop,nop,sackOK], length 0
07:26:58.104817 12:34:56:78:9a:bc > 00:22:48:56:04:a4, ethertype IPv4 (0x0800), length 74: 125.22.100.227.46492 > 20.212.124.152.443: Flags [S], seq 3746095654, win 29200, options [mss 1460,sackOK,TS val 1872833276 ecr 0,nop,wscale 7], length 0
07:26:58.104817 12:34:56:78:9a:bc > 00:22:48:56:04:a4, ethertype IPv4 (0x0800), length 74: 125.22.100.227.46526 > 20.212.124.152.443: Flags [S], seq 1344684676, win 29200, options [mss 1460,sackOK,TS val 1872833276 ecr 0,nop,wscale 7], length 0
07:26:58.104824 00:22:48:56:04:a4 > 12:34:56:78:9a:bc, ethertype IPv4 (0x0800), length 66: 20.212.124.152.443 > 125.22.100.227.46532: Flags [S.], seq 4225086147, ack 901424909, win 8190, options [mss 1460,nop,wscale 8,nop,nop,sackOK], length 0
07:26:58.104857 00:22:48:56:04:a4 > 12:34:56:78:9a:bc, ethertype IPv4 (0x0800), length 66: 20.212.124.152.443 > 125.22.100.227.46500: Flags [S.], seq 2948153894, ack 2936548121, win 8190, options [mss 1460,nop,wscale 8,nop,nop,sackOK], length 0
07:26:58.104879 12:34:56:78:9a:bc > 00:22:48:56:04:a4, ethertype IPv4 (0x0800), length 74: 125.22.100.227.46546 > 20.212.124.152.443: Flags [S], seq 1110823808, win 29200, options [mss 1460,sackOK,TS val 1872833276 ecr 0,nop,wscale 7], length 0
07:26:58.104882 00:22:48:56:04:a4 > 12:34:56:78:9a:bc, ethertype IPv4 (0x0800), length 66: 20.212.124.152.443 > 125.22.100.227.46492: Flags [S.], seq 4059778722, ack 3746095655, win 8190, options [mss 1460,nop,wscale 8,nop,nop,sackOK], length 0
07:26:58.104899 00:22:48:56:04:a4 > 12:34:56:78:9a:bc, ethertype IPv4 (0x0800), length 66: 20.212.124.152.443 > 125.22.100.227.46504: Flags [S.], seq 597749442, ack 3302277037, win 8190, options [mss 1460,nop,wscale 8,nop,nop,sackOK], length 0
07:26:58.104905 12:34:56:78:9a:bc > 00:22:48:56:04:a4, ethertype IPv4 (0x0800), length 74: 125.22.100.227.46522 > 20.212.124.152.443: Flags [S], seq 3551619691, win 29200, options [mss 1460,sackOK,TS val 1872833276 ecr 0,nop,wscale 7], length 0
07:26:58.104946 00:22:48:56:04:a4 > 12:34:56:78:9a:bc, ethertype IPv4 (0x0800), length 66: 20.212.124.152.443 > 125.22.100.227.46526: Flags [S.], seq 3616410719, ack 1344684677, win 8190, options [mss 1460,nop,wscale 8,nop,nop,sackOK], length 0
07:26:58.104976 00:22:48:56:04:a4 > 12:34:56:78:9a:bc, ethertype IPv4 (0x0800), length 66: 20.212.124.152.443 > 125.22.100.227.46546: Flags [S.], seq 254126151, ack 1110823809, win 8190, options [mss 1460,nop,wscale 8,nop,nop,sackOK], length 0
07:26:58.104987 00:22:48:56:04:a4 > 12:34:56:78:9a:bc, ethertype IPv4 (0x0800), length 66: 20.212.124.152.443 > 125.22.100.227.46522: Flags [S.], seq 4261054676, ack 3551619692, win 8190, options [mss 1460,nop,wscale 8,nop,nop,sackOK], length 0
07:26:58.105012 12:34:56:78:9a:bc > 00:22:48:56:04:a4, ethertype IPv4 (0x0800), length 74: 125.22.100.227.46564 > 20.212.124.152.443: Flags [S], seq 3957100194, win 29200, options [mss 1460,sackOK,TS val 1872833276 ecr 0,nop,wscale 7], length 0
07:26:58.105012 12:34:56:78:9a:bc > 00:22:48:56:04:a4, ethertype IPv4 (0x0800), length 74: 125.22.100.227.46536 > 20.212.124.152.443: Flags [S], seq 3558043704, win 29200, options [mss 1460,sackOK,TS val 1872833276 ecr 0,nop,wscale 7], length 0
07:26:58.105012 12:34:56:78:9a:bc > 00:22:48:56:04:a4, ethertype IPv4 (0x0800), length 74: 125.22.100.227.46560 > 20.212.124.152.443: Flags [S], seq 1871829518, win 29200, options [mss 1460,sackOK,TS val 1872833276 ecr 0,nop,wscale 7], length 0
07:26:58.105014 12:34:56:78:9a:bc > 00:22:48:56:04:a4, ethertype IPv4 (0x0800), length 74: 125.22.100.227.46512 > 20.212.124.152.443: Flags [S], seq 2274667185, win 29200, options [mss 1460,sackOK,TS val 1872833276 ecr 0,nop,wscale 7], length 0
07:26:58.105014 12:34:56:78:9a:bc > 00:22:48:56:04:a4, ethertype IPv4 (0x0800), length 74: 125.22.100.227.46472 > 20.212.124.152.443: Flags [S], seq 2315903881, win 29200, options [mss 1460,sackOK,TS val 1872833276 ecr 0,nop,wscale 7], length 0
07:26:58.105014 12:34:56:78:9a:bc > 00:22:48:56:04:a4, ethertype IPv4 (0x0800), length 74: 125.22.100.227.46508 > 20.212.124.152.443: Flags [S], seq 977146515, win 29200, options [mss 1460,sackOK,TS val 1872833276 ecr 0,nop,wscale 7], length 0
07:26:58.105014 12:34:56:78:9a:bc > 00:22:48:56:04:a4, ethertype IPv4 (0x0800), length 74: 125.22.100.227.46548 > 20.212.124.152.443: Flags [S], seq 2197137333, win 29200, options [mss 1460,sackOK,TS val 1872833276 ecr 0,nop,wscale 7], length 0
07:26:58.105014 12:34:56:78:9a:bc > 00:22:48:56:04:a4, ethertype IPv4 (0x0800), length 74: 125.22.100.227.46552 > 20.212.124.152.443: Flags [S], seq 2336380655, win 29200, options [mss 1460,sackOK,TS val 1872833276 ecr 0,nop,wscale 7], length 0
07:26:58.105014 12:34:56:78:9a:bc > 00:22:48:56:04:a4, ethertype IPv4 (0x0800), length 74: 125.22.100.227.46544 > 20.212.124.152.443: Flags [S], seq 3905868599, win 29200, options [mss 1460,sackOK,TS val 1872833276 ecr 0,nop,wscale 7], length 0
07:26:58.105062 12:34:56:78:9a:bc > 00:22:48:56:04:a4, ethertype IPv4 (0x0800), length 74: 125.22.100.227.46534 > 20.212.124.152.443: Flags [S], seq 4097598542, win 29200, options [mss 1460,sackOK,TS val 1872833276 ecr 0,nop,wscale 7], length 0
07:26:58.105085 12:34:56:78:9a:bc > 00:22:48:56:04:a4, ethertype IPv4 (0x0800), length 74: 125.22.100.227.46524 > 20.212.124.152.443: Flags [S], seq 1297294055, win 29200, options [mss 1460,sackOK,TS val 1872833276 ecr 0,nop,wscale 7], length 0
07:26:58.105089 12:34:56:78:9a:bc > 00:22:48:56:04:a4, ethertype IPv4 (0x0800), length 74: 125.22.100.227.46514 > 20.212.124.152.443: Flags [S], seq 2791312418, win 29200, options [mss 1460,sackOK,TS val 1872833276 ecr 0,nop,wscale 7], length 0
07:26:58.105094 00:22:48:56:04:a4 > 12:34:56:78:9a:bc, ethertype IPv4 (0x0800), length 66: 20.212.124.152.443 > 125.22.100.227.46564: Flags [S.], seq 2625123276, ack 3957100195, win 8190, options [mss 1460,nop,wscale 8,nop,nop,sackOK], length 0
07:26:58.105105 00:22:48:56:04:a4 > 12:34:56:78:9a:bc, ethertype IPv4 (0x0800), length 66: 20.212.124.152.443 > 125.22.100.227.46552: Flags [S.], seq 2540303849, ack 2336380656, win 8190, options [mss 1460,nop,wscale 8,nop,nop,sackOK], length 0
07:26:58.105113 12:34:56:78:9a:bc > 00:22:48:56:04:a4, ethertype IPv4 (0x0800), length 74: 125.22.100.227.46470 > 20.212.124.152.443: Flags [S], seq 1866553742, win 29200, options [mss 1460,sackOK,TS val 1872833276 ecr 0,nop,wscale 7], length 0
07:26:58.105117 00:22:48:56:04:a4 > 12:34:56:78:9a:bc, ethertype IPv4 (0x0800), length 66: 20.212.124.152.443 > 125.22.100.227.46548: Flags [S.], seq 881713977, ack 2197137334, win 8190, options [mss 1460,nop,wscale 8,nop,nop,sackOK], length 0
07:26:58.105145 12:34:56:78:9a:bc > 00:22:48:56:04:a4, ethertype IPv4 (0x0800), length 74: 125.22.100.227.46556 > 20.212.124.152.443: Flags [S], seq 4169810991, win 29200, options [mss 1460,sackOK,TS val 1872833276 ecr 0,nop,wscale 7], length 0
07:26:58.105224 12:34:56:78:9a:bc > 00:22:48:56:04:a4, ethertype IPv4 (0x0800), length 74: 125.22.100.227.46558 > 20.212.124.152.443: Flags [S], seq 3126026965, win 29200, options [mss 1460,sackOK,TS val 1872833276 ecr 0,nop,wscale 7], length 0
07:26:58.105249 12:34:56:78:9a:bc > 00:22:48:56:04:a4, ethertype IPv4 (0x0800), length 74: 125.22.100.227.46540 > 20.212.124.152.443: Flags [S], seq 1072764917, win 29200, options [mss 1460,sackOK,TS val 1872833276 ecr 0,nop,wscale 7], length 0
07:26:58.105250 12:34:56:78:9a:bc > 00:22:48:56:04:a4, ethertype IPv4 (0x0800), length 74: 125.22.100.227.46488 > 20.212.124.152.443: Flags [S], seq 1062977570, win 29200, options [mss 1460,sackOK,TS val 1872833276 ecr 0,nop,wscale 7], length 0
07:26:58.105249 12:34:56:78:9a:bc > 00:22:48:56:04:a4, ethertype IPv4 (0x0800), length 74: 125.22.100.227.46486 > 20.212.124.152.443: Flags [S], seq 2632229055, win 29200, options [mss 1460,sackOK,TS val 1872833276 ecr 0,nop,wscale 7], length 0
07:26:58.105250 12:34:56:78:9a:bc > 00:22:48:56:04:a4, ethertype IPv4 (0x0800), length 74: 125.22.100.227.46530 > 20.212.124.152.443: Flags [S], seq 1252641210, win 29200, options [mss 1460,sackOK,TS val 1872833276 ecr 0,nop,wscale 7], length 0
07:26:58.105253 12:34:56:78:9a:bc > 00:22:48:56:04:a4, ethertype IPv4 (0x0800), length 74: 125.22.100.227.46478 > 20.212.124.152.443: Flags [S], seq 3308873923, win 29200, options [mss 1460,sackOK,TS val 1872833276 ecr 0,nop,wscale 7], length 0
07:26:58.105289 00:22:48:56:04:a4 > 12:34:56:78:9a:bc, ethertype IPv4 (0x0800), length 66: 20.212.124.152.443 > 125.22.100.227.46514: Flags [S.], seq 654441291, ack 2791312419, win 8190, options [mss 1460,nop,wscale 8,nop,nop,sackOK], length 0
07:26:58.105310 00:22:48:56:04:a4 > 12:34:56:78:9a:bc, ethertype IPv4 (0x0800), length 66: 20.212.124.152.443 > 125.22.100.227.46478: Flags [S.], seq 739738050, ack 3308873924, win 8190, options [mss 1460,nop,wscale 8,nop,nop,sackOK], length 0
07:26:58.105323 00:22:48:56:04:a4 > 12:34:56:78:9a:bc, ethertype IPv4 (0x0800), length 66: 20.212.124.152.443 > 125.22.100.227.46488: Flags [S.], seq 2762323828, ack 1062977571, win 8190, options [mss 1460,nop,wscale 8,nop,nop,sackOK], length 0
07:26:58.105333 12:34:56:78:9a:bc > 00:22:48:56:04:a4, ethertype IPv4 (0x0800), length 74: 125.22.100.227.46520 > 20.212.124.152.443: Flags [S], seq 3691443689, win 29200, options [mss 1460,sackOK,TS val 1872833276 ecr 0,nop,wscale 7], length 0
07:26:58.105336 00:22:48:56:04:a4 > 12:34:56:78:9a:bc, ethertype IPv4 (0x0800), length 66: 20.212.124.152.443 > 125.22.100.227.46540: Flags [S.], seq 1701879996, ack 1072764918, win 8190, options [mss 1460,nop,wscale 8,nop,nop,sackOK], length 0
07:26:58.105348 00:22:48:56:04:a4 > 12:34:56:78:9a:bc, ethertype IPv4 (0x0800), length 66: 20.212.124.152.443 > 125.22.100.227.46486: Flags [S.], seq 2113124987, ack 2632229056, win 8190, options [mss 1460,nop,wscale 8,nop,nop,sackOK], length 0
07:26:58.105319 00:22:48:56:04:a4 > 12:34:56:78:9a:bc, ethertype IPv4 (0x0800), length 66: 20.212.124.152.443 > 125.22.100.227.46512: Flags [S.], seq 3154757364, ack 2274667186, win 8190, options [mss 1460,nop,wscale 8,nop,nop,sackOK], length 0
07:26:58.105476 00:22:48:56:04:a4 > 12:34:56:78:9a:bc, ethertype IPv4 (0x0800), length 66: 20.212.124.152.443 > 125.22.100.227.46508: Flags [S.], seq 1820809008, ack 977146516, win 8190, options [mss 1460,nop,wscale 8,nop,nop,sackOK], length 0
07:26:58.105477 12:34:56:78:9a:bc > 00:22:48:56:04:a4, ethertype IPv4 (0x0800), length 74: 125.22.100.227.46562 > 20.212.124.152.443: Flags [S], seq 3725613692, win 29200, options [mss 1460,sackOK,TS val 1872833276 ecr 0,nop,wscale 7], length 0
07:26:58.105477 12:34:56:78:9a:bc > 00:22:48:56:04:a4, ethertype IPv4 (0x0800), length 74: 125.22.100.227.46542 > 20.212.124.152.443: Flags [S], seq 1460997040, win 29200, options [mss 1460,sackOK,TS val 1872833276 ecr 0,nop,wscale 7], length 0
07:26:58.105477 12:34:56:78:9a:bc > 00:22:48:56:04:a4, ethertype IPv4 (0x0800), length 74: 125.22.100.227.46566 > 20.212.124.152.443: Flags [S], seq 649186115, win 29200, options [mss 1460,sackOK,TS val 1872833276 ecr 0,nop,wscale 7], length 0
07:26:58.105505 00:22:48:56:04:a4 > 12:34:56:78:9a:bc, ethertype IPv4 (0x0800), length 66: 20.212.124.152.443 > 125.22.100.227.46560: Flags [S.], seq 2739923134, ack 1871829519, win 8190, options [mss 1460,nop,wscale 8,nop,nop,sackOK], length 0
07:26:58.105517 12:34:56:78:9a:bc > 00:22:48:56:04:a4, ethertype IPv4 (0x0800), length 74: 125.22.100.227.46494 > 20.212.124.152.443: Flags [S], seq 2081390960, win 29200, options [mss 1460,sackOK,TS val 1872833276 ecr 0,nop,wscale 7], length 0
07:26:58.105549 00:22:48:56:04:a4 > 12:34:56:78:9a:bc, ethertype IPv4 (0x0800), length 66: 20.212.124.152.443 > 125.22.100.227.46562: Flags [S.], seq 3683854342, ack 3725613693, win 8190, options [mss 1460,nop,wscale 8,nop,nop,sackOK], length 0
07:26:58.105557 00:22:48:56:04:a4 > 12:34:56:78:9a:bc, ethertype IPv4 (0x0800), length 66: 20.212.124.152.443 > 125.22.100.227.46472: Flags [S.], seq 1727121259, ack 2315903882, win 8190, options [mss 1460,nop,wscale 8,nop,nop,sackOK], length 0
07:26:58.105557 00:22:48:56:04:a4 > 12:34:56:78:9a:bc, ethertype IPv4 (0x0800), length 66: 20.212.124.152.443 > 125.22.100.227.46544: Flags [S.], seq 1043990688, ack 3905868600, win 8190, options [mss 1460,nop,wscale 8,nop,nop,sackOK], length 0
07:26:58.105567 00:22:48:56:04:a4 > 12:34:56:78:9a:bc, ethertype IPv4 (0x0800), length 66: 20.212.124.152.443 > 125.22.100.227.46542: Flags [S.], seq 533608161, ack 1460997041, win 8190, options [mss 1460,nop,wscale 8,nop,nop,sackOK], length 0
07:26:58.105574 00:22:48:56:04:a4 > 12:34:56:78:9a:bc, ethertype IPv4 (0x0800), length 66: 20.212.124.152.443 > 125.22.100.227.46530: Flags [S.], seq 2585013701, ack 1252641211, win 8190, options [mss 1460,nop,wscale 8,nop,nop,sackOK], length 0
07:26:58.105577 00:22:48:56:04:a4 > 12:34:56:78:9a:bc, ethertype IPv4 (0x0800), length 66: 20.212.124.152.443 > 125.22.100.227.46566: Flags [S.], seq 3872390197, ack 649186116, win 8190, options [mss 1460,nop,wscale 8,nop,nop,sackOK], length 0
07:26:58.105586 00:22:48:56:04:a4 > 12:34:56:78:9a:bc, ethertype IPv4 (0x0800), length 66: 20.212.124.152.443 > 125.22.100.227.46536: Flags [S.], seq 3293408796, ack 3558043705, win 8190, options [mss 1460,nop,wscale 8,nop,nop,sackOK], length 0
07:26:58.105588 00:22:48:56:04:a4 > 12:34:56:78:9a:bc, ethertype IPv4 (0x0800), length 66: 20.212.124.152.443 > 125.22.100.227.46494: Flags [S.], seq 3814078770, ack 2081390961, win 8190, options [mss 1460,nop,wscale 8,nop,nop,sackOK], length 0
07:26:58.105753 00:22:48:56:04:a4 > 12:34:56:78:9a:bc, ethertype IPv4 (0x0800), length 66: 20.212.124.152.443 > 125.22.100.227.46534: Flags [S.], seq 2950125812, ack 4097598543, win 8190, options [mss 1460,nop,wscale 8,nop,nop,sackOK], length 0
07:26:58.105768 00:22:48:56:04:a4 > 12:34:56:78:9a:bc, ethertype IPv4 (0x0800), length 66: 20.212.124.152.443 > 125.22.100.227.46524: Flags [S.], seq 2203858164, ack 1297294056, win 8190, options [mss 1460,nop,wscale 8,nop,nop,sackOK], length 0
07:26:58.105782 00:22:48:56:04:a4 > 12:34:56:78:9a:bc, ethertype IPv4 (0x0800), length 66: 20.212.124.152.443 > 125.22.100.227.46470: Flags [S.], seq 225206258, ack 1866553743, win 8190, options [mss 1460,nop,wscale 8,nop,nop,sackOK], length 0
07:26:58.105793 00:22:48:56:04:a4 > 12:34:56:78:9a:bc, ethertype IPv4 (0x0800), length 66: 20.212.124.152.443 > 125.22.100.227.46556: Flags [S.], seq 1689197942, ack 4169810992, win 8190, options [mss 1460,nop,wscale 8,nop,nop,sackOK], length 0
07:26:58.105805 00:22:48:56:04:a4 > 12:34:56:78:9a:bc, ethertype IPv4 (0x0800), length 66: 20.212.124.152.443 > 125.22.100.227.46558: Flags [S.], seq 812737348, ack 3126026966, win 8190, options [mss 1460,nop,wscale 8,nop,nop,sackOK], length 0
07:26:58.105815 00:22:48:56:04:a4 > 12:34:56:78:9a:bc, ethertype IPv4 (0x0800), length 66: 20.212.124.152.443 > 125.22.100.227.46520: Flags [S.], seq 2838122398, ack 3691443690, win 8190, options [mss 1460,nop,wscale 8,nop,nop,sackOK], length 0
07:26:58.106022 12:34:56:78:9a:bc > 00:22:48:56:04:a4, ethertype IPv4 (0x0800), length 74: 125.22.100.227.46518 > 20.212.124.152.443: Flags [S], seq 1734401623, win 29200, options [mss 1460,sackOK,TS val 1872833276 ecr 0,nop,wscale 7], length 0
07:26:58.106070 00:22:48:56:04:a4 > 12:34:56:78:9a:bc, ethertype IPv4 (0x0800), length 66: 20.212.124.152.443 > 125.22.100.227.46518: Flags [S.], seq 442264626, ack 1734401624, win 8190, options [mss 1460,nop,wscale 8,nop,nop,sackOK], length 0
07:26:58.106239 12:34:56:78:9a:bc > 00:22:48:56:04:a4, ethertype IPv4 (0x0800), length 74: 125.22.100.227.46502 > 20.212.124.152.443: Flags [S], seq 1355193497, win 29200, options [mss 1460,sackOK,TS val 1872833276 ecr 0,nop,wscale 7], length 0
07:26:58.106279 00:22:48:56:04:a4 > 12:34:56:78:9a:bc, ethertype IPv4 (0x0800), length 66: 20.212.124.152.443 > 125.22.100.227.46502: Flags [S.], seq 1210576745, ack 1355193498, win 8190, options [mss 1460,nop,wscale 8,nop,nop,sackOK], length 0
07:26:58.106568 12:34:56:78:9a:bc > 00:22:48:56:04:a4, ethertype IPv4 (0x0800), length 74: 125.22.100.227.46482 > 20.212.124.152.443: Flags [S], seq 115723124, win 29200, options [mss 1460,sackOK,TS val 1872833276 ecr 0,nop,wscale 7], length 0
07:26:58.106630 00:22:48:56:04:a4 > 12:34:56:78:9a:bc, ethertype IPv4 (0x0800), length 66: 20.212.124.152.443 > 125.22.100.227.46482: Flags [S.], seq 2912127605, ack 115723125, win 8190, options [mss 1460,nop,wscale 8,nop,nop,sackOK], length 0
07:26:58.106649 12:34:56:78:9a:bc > 00:22:48:56:04:a4, ethertype IPv4 (0x0800), length 74: 125.22.100.227.46474 > 20.212.124.152.443: Flags [S], seq 2884690890, win 29200, options [mss 1460,sackOK,TS val 1872833276 ecr 0,nop,wscale 7], length 0
07:26:58.106789 00:22:48:56:04:a4 > 12:34:56:78:9a:bc, ethertype IPv4 (0x0800), length 66: 20.212.124.152.443 > 125.22.100.227.46474: Flags [S.], seq 4077340751, ack 2884690891, win 8190, options [mss 1460,nop,wscale 8,nop,nop,sackOK], length 0
07:26:58.143660 12:34:56:78:9a:bc > 00:22:48:56:04:a4, ethertype IPv4 (0x0800), length 60: 125.22.100.227.46538 > 20.212.124.152.443: Flags [.], ack 1, win 229, length 0
07:26:58.143744 12:34:56:78:9a:bc > 00:22:48:56:04:a4, ethertype IPv4 (0x0800), length 60: 125.22.100.227.46498 > 20.212.124.152.443: Flags [.], ack 1, win 229, length 0
07:26:58.143955 12:34:56:78:9a:bc > 00:22:48:56:04:a4, ethertype IPv4 (0x0800), length 60: 125.22.100.227.46496 > 20.212.124.152.443: Flags [.], ack 1, win 229, length 0
07:26:58.144178 12:34:56:78:9a:bc > 00:22:48:56:04:a4, ethertype IPv4 (0x0800), length 60: 125.22.100.227.46490 > 20.212.124.152.443: Flags [.], ack 1, win 229, length 0
07:26:58.144281 12:34:56:78:9a:bc > 00:22:48:56:04:a4, ethertype IPv4 (0x0800), length 60: 125.22.100.227.46568 > 20.212.124.152.443: Flags [.], ack 1, win 229, length 0
07:26:58.144281 12:34:56:78:9a:bc > 00:22:48:56:04:a4, ethertype IPv4 (0x0800), length 60: 125.22.100.227.46532 > 20.212.124.152.443: Flags [.], ack 1, win 229, length 0
07:26:58.144313 12:34:56:78:9a:bc > 00:22:48:56:04:a4, ethertype IPv4 (0x0800), length 60: 125.22.100.227.46492 > 20.212.124.152.443: Flags [.], ack 1, win 229, length 0
07:26:58.144313 12:34:56:78:9a:bc > 00:22:48:56:04:a4, ethertype IPv4 (0x0800), length 60: 125.22.100.227.46516 > 20.212.124.152.443: Flags [.], ack 1, win 229, length 0
07:26:58.144454 12:34:56:78:9a:bc > 00:22:48:56:04:a4, ethertype IPv4 (0x0800), length 60: 125.22.100.227.46504 > 20.212.124.152.443: Flags [.], ack 1, win 229, length 0
07:26:58.144555 12:34:56:78:9a:bc > 00:22:48:56:04:a4, ethertype IPv4 (0x0800), length 60: 125.22.100.227.46526 > 20.212.124.152.443: Flags [.], ack 1, win 229, length 0
07:26:58.144557 12:34:56:78:9a:bc > 00:22:48:56:04:a4, ethertype IPv4 (0x0800), length 60: 125.22.100.227.46528 > 20.212.124.152.443: Flags [.], ack 1, win 229, length 0
07:26:58.144575 12:34:56:78:9a:bc > 00:22:48:56:04:a4, ethertype IPv4 (0x0800), length 60: 125.22.100.227.46506 > 20.212.124.152.443: Flags [.], ack 1, win 229, length 0
07:26:58.144586 12:34:56:78:9a:bc > 00:22:48:56:04:a4, ethertype IPv4 (0x0800), length 60: 125.22.100.227.46546 > 20.212.124.152.443: Flags [.], ack 1, win 229, length 0
07:26:58.144648 12:34:56:78:9a:bc > 00:22:48:56:04:a4, ethertype IPv4 (0x0800), length 60: 125.22.100.227.46480 > 20.212.124.152.443: Flags [.], ack 1, win 229, length 0
07:26:58.144678 12:34:56:78:9a:bc > 00:22:48:56:04:a4, ethertype IPv4 (0x0800), length 60: 125.22.100.227.46510 > 20.212.124.152.443: Flags [.], ack 1, win 229, length 0
07:26:58.144739 12:34:56:78:9a:bc > 00:22:48:56:04:a4, ethertype IPv4 (0x0800), length 60: 125.22.100.227.46552 > 20.212.124.152.443: Flags [.], ack 1, win 229, length 0
07:26:58.144781 12:34:56:78:9a:bc > 00:22:48:56:04:a4, ethertype IPv4 (0x0800), length 60: 125.22.100.227.46550 > 20.212.124.152.443: Flags [.], ack 1, win 229, length 0
07:26:58.144969 12:34:56:78:9a:bc > 00:22:48:56:04:a4, ethertype IPv4 (0x0800), length 60: 125.22.100.227.46512 > 20.212.124.152.443: Flags [.], ack 1, win 229, length 0
07:26:58.145014 12:34:56:78:9a:bc > 00:22:48:56:04:a4, ethertype IPv4 (0x0800), length 60: 125.22.100.227.46548 > 20.212.124.152.443: Flags [.], ack 1, win 229, length 0
07:26:58.145424 12:34:56:78:9a:bc > 00:22:48:56:04:a4, ethertype IPv4 (0x0800), length 60: 125.22.100.227.46514 > 20.212.124.152.443: Flags [.], ack 1, win 229, length 0
07:26:58.145424 12:34:56:78:9a:bc > 00:22:48:56:04:a4, ethertype IPv4 (0x0800), length 60: 125.22.100.227.46486 > 20.212.124.152.443: Flags [.], ack 1, win 229, length 0
07:26:58.145424 12:34:56:78:9a:bc > 00:22:48:56:04:a4, ethertype IPv4 (0x0800), length 60: 125.22.100.227.46542 > 20.212.124.152.443: Flags [.], ack 1, win 229, length 0
07:26:58.145424 12:34:56:78:9a:bc > 00:22:48:56:04:a4, ethertype IPv4 (0x0800), length 60: 125.22.100.227.46530 > 20.212.124.152.443: Flags [.], ack 1, win 229, length 0
07:26:58.145435 12:34:56:78:9a:bc > 00:22:48:56:04:a4, ethertype IPv4 (0x0800), length 60: 125.22.100.227.46472 > 20.212.124.152.443: Flags [.], ack 1, win 229, length 0
07:26:58.145435 12:34:56:78:9a:bc > 00:22:48:56:04:a4, ethertype IPv4 (0x0800), length 60: 125.22.100.227.46540 > 20.212.124.152.443: Flags [.], ack 1, win 229, length 0
07:26:58.145435 12:34:56:78:9a:bc > 00:22:48:56:04:a4, ethertype IPv4 (0x0800), length 60: 125.22.100.227.46564 > 20.212.124.152.443: Flags [.], ack 1, win 229, length 0
07:26:58.145481 12:34:56:78:9a:bc > 00:22:48:56:04:a4, ethertype IPv4 (0x0800), length 60: 125.22.100.227.46560 > 20.212.124.152.443: Flags [.], ack 1, win 229, length 0
07:26:58.145491 12:34:56:78:9a:bc > 00:22:48:56:04:a4, ethertype IPv4 (0x0800), length 60: 125.22.100.227.46562 > 20.212.124.152.443: Flags [.], ack 1, win 229, length 0
07:26:58.145541 12:34:56:78:9a:bc > 00:22:48:56:04:a4, ethertype IPv4 (0x0800), length 60: 125.22.100.227.46522 > 20.212.124.152.443: Flags [.], ack 1, win 229, length 0
07:26:58.145610 12:34:56:78:9a:bc > 00:22:48:56:04:a4, ethertype IPv4 (0x0800), length 60: 125.22.100.227.46536 > 20.212.124.152.443: Flags [.], ack 1, win 229, length 0
07:26:58.145610 12:34:56:78:9a:bc > 00:22:48:56:04:a4, ethertype IPv4 (0x0800), length 60: 125.22.100.227.46484 > 20.212.124.152.443: Flags [.], ack 1, win 229, length 0
07:26:58.145688 12:34:56:78:9a:bc > 00:22:48:56:04:a4, ethertype IPv4 (0x0800), length 60: 125.22.100.227.46524 > 20.212.124.152.443: Flags [.], ack 1, win 229, length 0
07:26:58.145729 12:34:56:78:9a:bc > 00:22:48:56:04:a4, ethertype IPv4 (0x0800), length 60: 125.22.100.227.46558 > 20.212.124.152.443: Flags [.], ack 1, win 229, length 0
07:26:58.145822 12:34:56:78:9a:bc > 00:22:48:56:04:a4, ethertype IPv4 (0x0800), length 60: 125.22.100.227.46500 > 20.212.124.152.443: Flags [.], ack 1, win 229, length 0
07:26:58.146104 12:34:56:78:9a:bc > 00:22:48:56:04:a4, ethertype IPv4 (0x0800), length 60: 125.22.100.227.46534 > 20.212.124.152.443: Flags [.], ack 1, win 229, length 0
07:26:58.146174 12:34:56:78:9a:bc > 00:22:48:56:04:a4, ethertype IPv4 (0x0800), length 60: 125.22.100.227.46566 > 20.212.124.152.443: Flags [.], ack 1, win 229, length 0
07:26:58.146249 12:34:56:78:9a:bc > 00:22:48:56:04:a4, ethertype IPv4 (0x0800), length 60: 125.22.100.227.46488 > 20.212.124.152.443: Flags [.], ack 1, win 229, length 0
07:26:58.146507 12:34:56:78:9a:bc > 00:22:48:56:04:a4, ethertype IPv4 (0x0800), length 60: 125.22.100.227.46520 > 20.212.124.152.443: Flags [.], ack 1, win 229, length 0
07:26:58.146558 12:34:56:78:9a:bc > 00:22:48:56:04:a4, ethertype IPv4 (0x0800), length 60: 125.22.100.227.46508 > 20.212.124.152.443: Flags [.], ack 1, win 229, length 0
07:26:58.146751 12:34:56:78:9a:bc > 00:22:48:56:04:a4, ethertype IPv4 (0x0800), length 60: 125.22.100.227.46518 > 20.212.124.152.443: Flags [.], ack 1, win 229, length 0
07:26:58.146992 12:34:56:78:9a:bc > 00:22:48:56:04:a4, ethertype IPv4 (0x0800), length 60: 125.22.100.227.46470 > 20.212.124.152.443: Flags [.], ack 1, win 229, length 0
07:26:58.147015 12:34:56:78:9a:bc > 00:22:48:56:04:a4, ethertype IPv4 (0x0800), length 60: 125.22.100.227.46556 > 20.212.124.152.443: Flags [.], ack 1, win 229, length 0
07:26:58.147036 12:34:56:78:9a:bc > 00:22:48:56:04:a4, ethertype IPv4 (0x0800), length 60: 125.22.100.227.46494 > 20.212.124.152.443: Flags [.], ack 1, win 229, length 0
07:26:58.147119 12:34:56:78:9a:bc > 00:22:48:56:04:a4, ethertype IPv4 (0x0800), length 60: 125.22.100.227.46478 > 20.212.124.152.443: Flags [.], ack 1, win 229, length 0
07:26:58.147204 12:34:56:78:9a:bc > 00:22:48:56:04:a4, ethertype IPv4 (0x0800), length 60: 125.22.100.227.46544 > 20.212.124.152.443: Flags [.], ack 1, win 229, length 0
07:26:58.147866 12:34:56:78:9a:bc > 00:22:48:56:04:a4, ethertype IPv4 (0x0800), length 60: 125.22.100.227.46482 > 20.212.124.152.443: Flags [.], ack 1, win 229, length 0
07:26:58.148635 12:34:56:78:9a:bc > 00:22:48:56:04:a4, ethertype IPv4 (0x0800), length 60: 125.22.100.227.46502 > 20.212.124.152.443: Flags [.], ack 1, win 229, length 0
07:26:58.150372 12:34:56:78:9a:bc > 00:22:48:56:04:a4, ethertype IPv4 (0x0800), length 60: 125.22.100.227.46474 > 20.212.124.152.443: Flags [.], ack 1, win 229, length 0
07:26:58.298992 12:34:56:78:9a:bc > 00:22:48:56:04:a4, ethertype IPv4 (0x0800), length 329: 125.22.100.227.46490 > 20.212.124.152.443: Flags [P.], seq 1:276, ack 1, win 342, length 275
07:26:58.299640 12:34:56:78:9a:bc > 00:22:48:56:04:a4, ethertype IPv4 (0x0800), length 329: 125.22.100.227.46480 > 20.212.124.152.443: Flags [P.], seq 1:276, ack 1, win 342, length 275
07:26:58.299767 00:22:48:56:04:a4 > 12:34:56:78:9a:bc, ethertype IPv4 (0x0800), length 133: 20.212.124.152.443 > 125.22.100.227.46490: Flags [P.], seq 1:80, ack 276, win 512, length 79
07:26:58.299877 00:22:48:56:04:a4 > 12:34:56:78:9a:bc, ethertype IPv4 (0x0800), length 1015: 20.212.124.152.443 > 125.22.100.227.46490: Flags [P.], seq 80:1041, ack 276, win 512, length 961
07:26:58.299951 00:22:48:56:04:a4 > 12:34:56:78:9a:bc, ethertype IPv4 (0x0800), length 133: 20.212.124.152.443 > 125.22.100.227.46480: Flags [P.], seq 1:80, ack 276, win 512, length 79
07:26:58.300012 00:22:48:56:04:a4 > 12:34:56:78:9a:bc, ethertype IPv4 (0x0800), length 1015: 20.212.124.152.443 > 125.22.100.227.46480: Flags [P.], seq 80:1041, ack 276, win 512, length 961
07:26:58.300976 12:34:56:78:9a:bc > 00:22:48:56:04:a4, ethertype IPv4 (0x0800), length 329: 125.22.100.227.46488 > 20.212.124.152.443: Flags [P.], seq 1:276, ack 1, win 342, length 275
07:26:58.301051 00:22:48:56:04:a4 > 12:34:56:78:9a:bc, ethertype IPv4 (0x0800), length 133: 20.212.124.152.443 > 125.22.100.227.46488: Flags [P.], seq 1:80, ack 276, win 512, length 79
07:26:58.301062 00:22:48:56:04:a4 > 12:34:56:78:9a:bc, ethertype IPv4 (0x0800), length 1015: 20.212.124.152.443 > 125.22.100.227.46488: Flags [P.], seq 80:1041, ack 276, win 512, length 961
07:26:58.339998 12:34:56:78:9a:bc > 00:22:48:56:04:a4, ethertype IPv4 (0x0800), length 60: 125.22.100.227.46490 > 20.212.124.152.443: Flags [.], ack 80, win 229, length 0
07:26:58.339998 12:34:56:78:9a:bc > 00:22:48:56:04:a4, ethertype IPv4 (0x0800), length 60: 125.22.100.227.46490 > 20.212.124.152.443: Flags [.], ack 1041, win 244, length 0
07:26:58.340770 12:34:56:78:9a:bc > 00:22:48:56:04:a4, ethertype IPv4 (0x0800), length 60: 125.22.100.227.46480 > 20.212.124.152.443: Flags [.], ack 80, win 229, length 0
07:26:58.340770 12:34:56:78:9a:bc > 00:22:48:56:04:a4, ethertype IPv4 (0x0800), length 60: 125.22.100.227.46480 > 20.212.124.152.443: Flags [.], ack 1041, win 244, length 0
07:26:58.340854 12:34:56:78:9a:bc > 00:22:48:56:04:a4, ethertype IPv4 (0x0800), length 396: 125.22.100.227.46490 > 20.212.124.152.443: Flags [P.], seq 276:618, ack 1041, win 244, length 342
07:26:58.340936 00:22:48:56:04:a4 > 12:34:56:78:9a:bc, ethertype IPv4 (0x0800), length 54: 20.212.124.152.443 > 125.22.100.227.46490: Flags [.], ack 618, win 511, length 0
07:26:58.341260 12:34:56:78:9a:bc > 00:22:48:56:04:a4, ethertype IPv4 (0x0800), length 396: 125.22.100.227.46480 > 20.212.124.152.443: Flags [P.], seq 276:618, ack 1041, win 244, length 342
07:26:58.342221 00:22:48:56:04:a4 > 12:34:56:78:9a:bc, ethertype IPv4 (0x0800), length 129: 20.212.124.152.443 > 125.22.100.227.46490: Flags [P.], seq 1041:1116, ack 618, win 511, length 75
07:26:58.342242 00:22:48:56:04:a4 > 12:34:56:78:9a:bc, ethertype IPv4 (0x0800), length 54: 20.212.124.152.443 > 125.22.100.227.46480: Flags [.], ack 618, win 511, length 0
07:26:58.342263 12:34:56:78:9a:bc > 00:22:48:56:04:a4, ethertype IPv4 (0x0800), length 60: 125.22.100.227.46488 > 20.212.124.152.443: Flags [.], ack 80, win 229, length 0
07:26:58.342264 12:34:56:78:9a:bc > 00:22:48:56:04:a4, ethertype IPv4 (0x0800), length 60: 125.22.100.227.46488 > 20.212.124.152.443: Flags [.], ack 1041, win 244, length 0
07:26:58.342518 12:34:56:78:9a:bc > 00:22:48:56:04:a4, ethertype IPv4 (0x0800), length 396: 125.22.100.227.46488 > 20.212.124.152.443: Flags [P.], seq 276:618, ack 1041, win 244, length 342
07:26:58.343555 00:22:48:56:04:a4 > 12:34:56:78:9a:bc, ethertype IPv4 (0x0800), length 129: 20.212.124.152.443 > 125.22.100.227.46480: Flags [P.], seq 1041:1116, ack 618, win 511, length 75
07:26:58.343567 00:22:48:56:04:a4 > 12:34:56:78:9a:bc, ethertype IPv4 (0x0800), length 54: 20.212.124.152.443 > 125.22.100.227.46488: Flags [.], ack 618, win 511, length 0
07:26:58.344902 00:22:48:56:04:a4 > 12:34:56:78:9a:bc, ethertype IPv4 (0x0800), length 129: 20.212.124.152.443 > 125.22.100.227.46488: Flags [P.], seq 1041:1116, ack 618, win 511, length 75
07:26:58.382535 12:34:56:78:9a:bc > 00:22:48:56:04:a4, ethertype IPv4 (0x0800), length 219: 125.22.100.227.46490 > 20.212.124.152.443: Flags [P.], seq 618:783, ack 1116, win 244, length 165
07:26:58.384440 12:34:56:78:9a:bc > 00:22:48:56:04:a4, ethertype IPv4 (0x0800), length 219: 125.22.100.227.46480 > 20.212.124.152.443: Flags [P.], seq 618:783, ack 1116, win 244, length 165
07:26:58.386083 12:34:56:78:9a:bc > 00:22:48:56:04:a4, ethertype IPv4 (0x0800), length 219: 125.22.100.227.46488 > 20.212.124.152.443: Flags [P.], seq 618:783, ack 1116, win 244, length 165
07:26:58.452374 12:34:56:78:9a:bc > 00:22:48:56:04:a4, ethertype IPv4 (0x0800), length 329: 125.22.100.227.46506 > 20.212.124.152.443: Flags [P.], seq 1:276, ack 1, win 342, length 275
07:26:58.452378 12:34:56:78:9a:bc > 00:22:48:56:04:a4, ethertype IPv4 (0x0800), length 329: 125.22.100.227.46516 > 20.212.124.152.443: Flags [P.], seq 1:276, ack 1, win 342, length 275
07:26:58.452439 12:34:56:78:9a:bc > 00:22:48:56:04:a4, ethertype IPv4 (0x0800), length 329: 125.22.100.227.46504 > 20.212.124.152.443: Flags [P.], seq 1:276, ack 1, win 342, length 275
07:26:58.452471 12:34:56:78:9a:bc > 00:22:48:56:04:a4, ethertype IPv4 (0x0800), length 329: 125.22.100.227.46510 > 20.212.124.152.443: Flags [P.], seq 1:276, ack 1, win 342, length 275
07:26:58.452499 12:34:56:78:9a:bc > 00:22:48:56:04:a4, ethertype IPv4 (0x0800), length 329: 125.22.100.227.46528 > 20.212.124.152.443: Flags [P.], seq 1:276, ack 1, win 342, length 275
07:26:58.452528 12:34:56:78:9a:bc > 00:22:48:56:04:a4, ethertype IPv4 (0x0800), length 329: 125.22.100.227.46552 > 20.212.124.152.443: Flags [P.], seq 1:276, ack 1, win 342, length 275
07:26:58.452583 00:22:48:56:04:a4 > 12:34:56:78:9a:bc, ethertype IPv4 (0x0800), length 133: 20.212.124.152.443 > 125.22.100.227.46516: Flags [P.], seq 1:80, ack 276, win 512, length 79
07:26:58.452598 00:22:48:56:04:a4 > 12:34:56:78:9a:bc, ethertype IPv4 (0x0800), length 1015: 20.212.124.152.443 > 125.22.100.227.46516: Flags [P.], seq 80:1041, ack 276, win 512, length 961
07:26:58.452598 00:22:48:56:04:a4 > 12:34:56:78:9a:bc, ethertype IPv4 (0x0800), length 133: 20.212.124.152.443 > 125.22.100.227.46506: Flags [P.], seq 1:80, ack 276, win 512, length 79
07:26:58.452637 00:22:48:56:04:a4 > 12:34:56:78:9a:bc, ethertype IPv4 (0x0800), length 133: 20.212.124.152.443 > 125.22.100.227.46504: Flags [P.], seq 1:80, ack 276, win 512, length 79
07:26:58.452641 00:22:48:56:04:a4 > 12:34:56:78:9a:bc, ethertype IPv4 (0x0800), length 1015: 20.212.124.152.443 > 125.22.100.227.46506: Flags [P.], seq 80:1041, ack 276, win 512, length 961
07:26:58.452665 00:22:48:56:04:a4 > 12:34:56:78:9a:bc, ethertype IPv4 (0x0800), length 133: 20.212.124.152.443 > 125.22.100.227.46528: Flags [P.], seq 1:80, ack 276, win 512, length 79
07:26:58.452669 00:22:48:56:04:a4 > 12:34:56:78:9a:bc, ethertype IPv4 (0x0800), length 1015: 20.212.124.152.443 > 125.22.100.227.46504: Flags [P.], seq 80:1041, ack 276, win 512, length 961
07:26:58.452680 00:22:48:56:04:a4 > 12:34:56:78:9a:bc, ethertype IPv4 (0x0800), length 1015: 20.212.124.152.443 > 125.22.100.227.46528: Flags [P.], seq 80:1041, ack 276, win 512, length 961
07:26:58.452694 00:22:48:56:04:a4 > 12:34:56:78:9a:bc, ethertype IPv4 (0x0800), length 133: 20.212.124.152.443 > 125.22.100.227.46552: Flags [P.], seq 1:80, ack 276, win 512, length 79
07:26:58.452702 00:22:48:56:04:a4 > 12:34:56:78:9a:bc, ethertype IPv4 (0x0800), length 1015: 20.212.124.152.443 > 125.22.100.227.46552: Flags [P.], seq 80:1041, ack 276, win 512, length 961
07:26:58.452749 00:22:48:56:04:a4 > 12:34:56:78:9a:bc, ethertype IPv4 (0x0800), length 133: 20.212.124.152.443 > 125.22.100.227.46510: Flags [P.], seq 1:80, ack 276, win 512, length 79
07:26:58.452768 00:22:48:56:04:a4 > 12:34:56:78:9a:bc, ethertype IPv4 (0x0800), length 1015: 20.212.124.152.443 > 125.22.100.227.46510: Flags [P.], seq 80:1041, ack 276, win 512, length 961
